"stringdb:9606.ENSP00000263377","2.232838","2.963277","1.638427","1.365528","1.990226","1.27733","1.680779","2.036416","5.0","1.160897","2.081845","BRD4","9606.ENSP00000263377","BRD4","false","9606.ENSP00000263377","O60885","9606.ENSP00000263377","Bromodomain-containing protein 4; Chromatin reader protein that recognizes and binds acetylated histones and plays a key role in transmission of epigenetic memory across cell divisions and transcription regulation. Remains associated with acetylated chromatin throughout the entire cell cycle and provides epigenetic memory for postmitotic G1 gene transcription by preserving acetylated chromatin status and maintaining high-order chromatin structure . During interphase, plays a key role in regulating the transcription of signal- inducible genes by associating with the P-TEFb complex and recruiting it to promoters. Also recruits P-TEFb complex to distal enhancers, so called anti-pause enhancers in collaboration with JMJD6. BRD4 and JMJD6 are required to form the transcriptionally active P-TEFb complex by displacing negative regulators such as HEXIM1 and 7SKsnRNA complex from P-TEFb, thereby transforming it into an active form that can then phosphorylate the C-terminal domain (CTD) of RNA polymerase II (PubMed:23589332, PubMed:19596240, PubMed:16109377, PubMed:16109376, PubMed:24360279). Promotes phosphorylation of 'Ser-2' of the C-terminal domain (CTD) of RNA polymerase II . According to a report, directly acts as an atypical protein kinase and mediates phosphorylation of 'Ser-2' of the C-terminal domain (CTD) of RNA polymerase II; these data however need additional evidences in vivo . In addition to acetylated histones, also recognizes and binds acetylated RELA, leading to further recruitment of the P-TEFb complex and subsequent activation of NF-kappa-B . Also acts as a regulator of p53/TP53-mediated transcription: following phosphorylation by CK2, recruited to p53/TP53 specific target promoters . ECO:0000269|PubMed:16109377, ECO:0000269|PubMed:19103749, ECO:0000269|PubMed:19596240, ECO:0000269|PubMed:22334664, ECO:0000269|PubMed:22509028, ECO:0000269|PubMed:23086925, ECO:0000269|PubMed:23317504, ECO:0000269|PubMed:23589332,","label: attribute=""display name"" labelsize=12 labelAlignment=left outline=true outlineColor=white outlineTransparency=95 outlineWidth=10 background=false color=black dropShadow=false",,"https://version-12-0.string-db.org/images/Proteinpictures/pdb/6d/6dne_A.png","stringdb","protein","MSAESGPGTRLRNLPVMGDGLETSQMSTTQAQAQPQPANAASTNPPPPETSNPNKPKRQTNQLQYLLRVVLKTLWKHQFAWPFQQPVDAVKLNLPDYYKIIKTPMDMGTIKKRLENNYYWNAQECIQDFNTMFTNCYIYNKPGDDIVLMAEALEKLFLQKINELPTEETEIMIVQAKGRGRGRKETGTAKPGVSTVPNTTQASTPPQTQTPQPNPPPVQATPHPFPAVTPDLIVQTPVMTVVPPQPLQTPPPVPPQPQPPPAPAPQPVQSHPPIIAATPQPVKTKKGVKRKADTTTPTTIDPIHEPPSLPPEPKTTKLGQRRESSRPVKPPKKDVPDSQQHPAPEKSSKVSEQLKCCSGILKEMFAKKHAAYAWPFYKPVDVEALGLHDYCDIIKHPMDMSTIKSKLEAREYRDAQEFGADVRLMFSNCYKYNPPDHEVVAMARKLQDVFEMRFAKMPDEPEEPVVAVSSPAVPPPTKVVAPPSSSDSSSDSSSDSDSSTDDSEEERAQRLAELQEQLKAVHEQLAALSQPQQNKPKKKEKDKKEKKKEKHKRKEEVEENKKSKAKEPPPKKTKKNNSSNSNVSKKEPAPMKSKPPPTYESEEEDKCKPMSYEEKRQLSLDINKLPGEKLGRVVHIIQSREPSLKNSNPDEIEIDFETLKPSTLRELERYVTSCLRKKRKPQAEKVDVIAGSSKMKGFSSSESESSSESSSSDSEDSETEMAPKSKKKGHPGREQKKHHHHHHQQMQQAPAPVPQQPPPPPQQPPPPPPPQQQQQPPPPPPPPSMPQQAAPAMKSSPPPFIATQVPVLEPQLPGSVFDPIGHFTQPILHLPQPELPPHLPQPPEHSTPPHLNQHAVVSPPALHNALPQQPSRPSNRAAALPPKPARPPAVSPALTQTPLLPQPPMAQPPQVLLEDEEPPAPPLTSMQMQLYLQQLQKVQPPTPLLPSVKVQSQPPPPLPPPPHPSVQQQLQQQPPPPPPPQPQPPPQQQHQPPPRPVHLQPMQFSTHIQQPPPPQGQQPPHPPPGQQPPPPQPAKPQQVIQHHHSPRHHKSDPYSTGHLREAPSPLMIHSPQMSQFQSLTHQSPPQQNVQPKKQELRAASVVQPQPLVVVKEEKIHSPIIRSEPFSPSLRPEPPKHPESIKAPVHLPQRPEMKPVDVGRPVIRPPEQNAPPPGAPDKDKQKQEPKTPVAPKKDLKIKNMGSWASLVQKHPTTPSSTAKSSSDSFEQFRRAAREKEEREKALKAQAEHAEKEKERLRQERMRSREDEDALEQARRAHEEARRRQEQQQQQRQEQQQQQQQQAAAVAAAATPQAQSSQPQSMLDQQRELARKREQERRRREAMAATIDMNFQSDLLSIFEENLF","Homo sapiens","string:","6dne,5t35,7la9,6bnh,7wl4,6vix,2nnu","Tchem","Epigenetic","2.048273","3.270315","2.039111","2.774246","2.34846","1.593136","2.894362","3.222605","3.16607","4.680958","3.599604","3.208365","4.199087","2.694959","2.181036","2.731578","2.770702","2.262057","2.390817","1.079909"
"stringdb:9606.ENSP00000363591","1.84566","4.041077","3.199252","1.509258","2.032043","1.314562","1.724935","5.0","2.274413","1.920851","2.407923","BAK1","9606.ENSP00000363591","BAK1","false","9606.ENSP00000363591","Q16611","9606.ENSP00000363591","Bcl-2 homologous antagonist/killer; Plays a role in the mitochondrial apoptosic process. Upon arrival of cell death signals, promotes mitochondrial outer membrane (MOM) permeabilization by oligomerizing to form pores within the MOM. This releases apoptogenic factors into the cytosol, including cytochrome c, promoting the activation of caspase 9 which in turn processes and activates the effector caspases. ","label: attribute=""display name"" labelsize=12 labelAlignment=left outline=true outlineColor=white outlineTransparency=95 outlineWidth=10 background=false color=black dropShadow=false",,"https://version-12-0.string-db.org/images/Proteinpictures/pdb/7m/7m5c_M.png","stringdb","protein","MASGQGPGPPRQECGEPALPSASEEQVAQDTEEVFRSYVFYRHQQEQEAEGVAAPADPEMVTLPLQPSSTMGQVGRQLAIIGDDINRRYDSEFQTMLQHLQPTAENAYEYFTKIATSLFESGINWGRVVALLGFGYRLALHVYQHGLTGFLGQVTRFVVDFMLHHCIARWIAQRGGWVAALNLGNGPILNVLVVLGVVLLGQFVVRRFFKS","Homo sapiens","string:","6uxo,7k02,7m5c,1bxl,7m5c,7ofo,3qbr,5ajk","Tbio","Other","1.892116","2.712936","1.519588","2.376529","1.221552","1.11994","2.306981","2.739333","2.237473","2.130654","4.52135","2.236868","4.425872","1.76273","1.34893","2.382809","2.254691","2.165171","1.553267","1.265078"
"stringdb:9606.ENSP00000478927","2.670947","5.0","1.895663","1.590223","2.343778","1.400743","1.665176","2.206926","5.0","1.534327","2.451588","YAP1","9606.ENSP00000478927","YAP1","false","9606.ENSP00000478927","P46937","9606.ENSP00000478927","Transcriptional coactivator YAP1; Transcriptional regulator which can act both as a coactivator and a corepressor and is the critical downstream regulatory target in the Hippo signaling pathway that plays a pivotal role in organ size control and tumor suppression by restricting proliferation and promoting apoptosis (PubMed:17974916, PubMed:18280240, PubMed:18579750, PubMed:21364637, PubMed:30447097). The core of this pathway is composed of a kinase cascade wherein STK3/MST2 and STK4/MST1, in complex with its regulatory protein SAV1, phosphorylates and activates LATS1/2 in complex with its regulatory protein MOB1, which in turn phosphorylates and inactivates YAP1 oncoprotein and WWTR1/TAZ . Plays a key role in tissue tension and 3D tissue shape by regulating cortical actomyosin network formation. Acts via ARHGAP18, a Rho GTPase activating protein that suppresses F-actin polymerization . Plays a key role to control cell proliferation in response to cell contact. Phosphorylation of YAP1 by LATS1/2 inhibits its translocation into the nucleus to regulate cellular genes important for cell proliferation, cell death, and cell migration . The presence of TEAD transcription factors are required for it to stimulate gene expression, cell growth, anchorage- independent growth, and epithelial mesenchymal transition (EMT) induction . ECO:0000269|PubMed:18158288, ECO:0000269|PubMed:18280240, ECO:0000269|PubMed:18579750, ECO:0000269|PubMed:21364637,","label: attribute=""display name"" labelsize=12 labelAlignment=left outline=true outlineColor=white outlineTransparency=95 outlineWidth=10 background=false color=black dropShadow=false",,"https://version-12-0.string-db.org/images/Proteinpictures/pdb/3k/3kys_B.png","stringdb","protein","MDPGQQPPPQPAPQGQGQPPSQPPQGQGPPSGPGQPAPAATQAAPQAPPAGHQIVHVRGDSETDLEALFNAVMNPKTANVPQTVPMRLRKLPDSFFKPPEPKSHSRQASTDAGTAGALTPQHVRAHSSPASLQLGAVSPGTLTPTGVVSGPAATPTAQHLRQSSFEIPDDVPLPAGWEMAKTSSGQRYFLNHIDQTTTWQDPRKAMLSQMNVTAPTSPPVQQNMMNSASGPLPDGWEQAMTQDGEIYYINHKNKTTSWLDPRLDPRFAMNQRISQSAPVKQPPPLAPQSPQGGVMGGSNSNQQQQMRLQQLQMEKERLRLKQQELLRQVRPQAMRNINPSTANSPKCQELALRSQLPTLEQDGGTQNPVSSPGMSQELRTMTTNSSDPFLNSGTYHSRDESTDSGLSMSSYSVPRTPDDFLNSVDEMDTGDTINQSTLPSQQNRFPDYLEAIPGTNVDLGTLEGDGMNIEGEELMPSLQEALSSDILNDMESVLAATKLDKESFLTWL","Homo sapiens","string:","2ltv,6hil,3kys,6jk1,5ydx,2ltw","Tchem","Other","2.250235","2.507975","2.043287","2.070132","2.214088","2.400887","3.248094","3.152862","3.131261","4.642534","4.677624","3.16668","4.627235","4.528337","2.314905","3.498173","2.565155","2.713545","3.014572","2.068726"
"stringdb:9606.ENSP00000380070","4.765719","4.919275","3.165785","2.81364","4.708638","2.627898","3.059414","3.722643","4.870271","2.746834","4.832538","GAPDH","9606.ENSP00000380070","GAPDH","false","9606.ENSP00000380070","P04406","9606.ENSP00000380070","Glyceraldehyde-3-phosphate dehydrogenase; Has both glyceraldehyde-3-phosphate dehydrogenase and nitrosylase activities, thereby playing a role in glycolysis and nuclear functions, respectively. Participates in nuclear events including transcription, RNA transport, DNA replication and apoptosis. Nuclear functions are probably due to the nitrosylase activity that mediates cysteine S-nitrosylation of nuclear target proteins such as SIRT1, HDAC2 and PRKDC. Modulates the organization and assembly of the cytoskeleton. Facilitates the CHP1-dependent microtubule and membrane associations through its ability to stimulate the binding of CHP1 to microtubules (By similarity). Glyceraldehyde-3-phosphate dehydrogenase is a key enzyme in glycolysis that catalyzes the first step of the pathway by converting D-glyceraldehyde 3-phosphate (G3P) into 3- phospho-D-glyceroyl phosphate. Component of the GAIT (gamma interferon- activated inhibitor of translation) complex which mediates interferon- gamma-induced transcript-selective translation inhibition in inflammation processes. Upon interferon-gamma treatment assembles into the GAIT complex which binds to stem loop-containing GAIT elements in the 3'-UTR of diverse inflammatory mRNAs (such as ceruplasmin) and suppresses their translation. ECO:0000269|PubMed:11724794, ECO:0000269|PubMed:23071094,","label: attribute=""display name"" labelsize=12 labelAlignment=left outline=true outlineColor=white outlineTransparency=95 outlineWidth=10 background=false color=black dropShadow=false",,"https://version-12-0.string-db.org/images/Proteinpictures/pdb/6y/6ynd_A.png","stringdb","protein","MGKVKVGVNGFGRIGRLVTRAAFNSGKVDIVAINDPFIDLNYMVYMFQYDSTHGKFHGTVKAENGKLVINGNPITIFQERDPSKIKWGDAGAEYVVESTGVFTTMEKAGAHLQGGAKRVIISAPSADAPMFVMGVNHEKYDNSLKIISNASCTTNCLAPLAKVIHDNFGIVEGLMTTVHAITATQKTVDGPSGKLWRDGRGALQNIIPASTGAAKAVGKVIPELNGKLTGMAFRVPTANVSVVDLTCRLEKPAKYDDIKKVVKQASEGPLKGILGYTEHQVVSSDFNSDTHSSTFDAGAGIALNDHFVKLISWYDNEFGYSNRVVDLMAHMASKE","Homo sapiens","string:","6ynd","Tchem","Enzyme","3.824705","4.9939","4.837218","4.240796","4.996456","3.545824","5.0","4.984589","4.99535","4.994828","4.999166","4.993476","4.999609","4.968614","3.65411","4.996406","4.034469","4.900764","4.034917","3.593452"
"stringdb:9606.ENSP00000358327","2.445188","5.0","2.414063","1.658245","4.524585","1.485916","2.163764","3.191948","5.0","1.202162","2.47845","CASP7","9606.ENSP00000358327","CASP7","false","9606.ENSP00000358327","P55210","9606.ENSP00000358327","Caspase-7 subunit p11; Involved in the activation cascade of caspases responsible for apoptosis execution. Cleaves and activates sterol regulatory element binding proteins (SREBPs). Proteolytically cleaves poly(ADP- ribose) polymerase (PARP) at a '216-Asp-|-Gly-217' bond. Overexpression promotes programmed cell death.","label: attribute=""display name"" labelsize=12 labelAlignment=left outline=true outlineColor=white outlineTransparency=95 outlineWidth=10 background=false color=black dropShadow=false",,"https://version-12-0.string-db.org/images/Proteinpictures/pdb/1i/1i4o_A.png","stringdb","protein","MRAGTRVALGSSTPAERTTPSQGRCKPRPALPRAAPPSAAPRLLVSLSLKGPQTLAAERRRETVPVPAALPPWERWQMIRAVLKSRGLRIQQMKIQWMLSQTGPRLYRPSSAPDSGTLYFTSKKKKNVTMRSIKTTRDRVPTYQYNMNFEKLGKCIIINNKNFDKVTGMGVRNGTDKDAEALFKCFRSLGFDVIVYNDCSCAKMQDLLKKASEEDHTNAACFACILLSHGEENVIYGKDGVTPIKDLTAHFRGDRCKTLLEKPKLFFIQACRGTELDDGIQADSGPINDTDANPRYKIPVEADFLFAYSTVPGYYSWRSPGRGSWFVQALCSILEEHGKDLEIMQILTRVNDRVARHFESQSDDPHFHEKKQIPCVVSMLTKELYFSQ","Homo sapiens","string:","1i51,1i51,1i4o","Tchem","Enzyme","2.106224","4.570706","1.900025","2.245627","2.042932","1.109466","2.897821","3.444434","2.930493","2.991252","4.631392","2.690649","3.948627","2.515425","2.08828","4.529985","4.577826","2.815071","1.970081","2.017989"
"stringdb:9606.ENSP00000386759","1.974453","3.190961","1.204633","0.839282","1.974496","1.062985","1.205547","2.180992","4.81271","0.963846","2.090469","SETD2","9606.ENSP00000386759","SETD2","false","9606.ENSP00000386759","Q9BYW2","9606.ENSP00000386759","Histone-lysine N-methyltransferase SETD2; Histone methyltransferase that specifically trimethylates 'Lys-36' of histone H3 (H3K36me3) using dimethylated 'Lys-36' (H3K36me2) as substrate (PubMed:16118227, PubMed:19141475, PubMed:21526191, PubMed:21792193, PubMed:23043551, PubMed:27474439). It is capable of trimethylating unmethylated H3K36 (H3K36me0) in vitro . Represents the main enzyme generating H3K36me3, a specific tag for epigenetic transcriptional activation (By similarity). Plays a role in chromatin structure modulation during elongation by coordinating recruitment of the FACT complex and by interacting with hyperphosphorylated POLR2A . Acts as a key regulator of DNA mismatch repair in G1 and early S phase by generating H3K36me3, a mark required to recruit MSH6 subunit of the MutS alpha complex: early recruitment of the MutS alpha complex to chromatin to be replicated allows a quick identification of mismatch DNA to initiate the mismatch repair reaction . Required for DNA double-strand break repair in response to DNA damage: acts by mediating formation of H3K36me3, promoting recruitment of RAD51 and DNA repair via homologous recombination (HR) . Acts as a tumor suppressor . H3K36me3 also plays an essential role in the maintenance of a heterochromatic state, by recruiting DNA methyltransferase DNMT3A . H3K36me3 is also enhanced in intron-containing genes, suggesting that SETD2 recruitment is enhanced by splicing and that splicing is coupled to recruitment of elongating RNA polymerase . Required during angiogenesis (By similarity). Required for endoderm development by promoting embryonic stem cell differentiation toward endoderm: acts by mediating formation of H3K36me3 in distal promoter regions of FGFR3, leading to regulate transcription initiation of FGFR3 (By similarity). In addition to histones, also mediates methylation of other proteins, such as tubulins and STAT1 . Trimethylates 'Lys-40' of alpha-tubulins such as TUBA1B (alpha- TubK40me3); alpha-TubK40me3 is required for normal mitosis and cytokinesis and may be a specific tag in cytoskeletal remodeling . Involved in interferon-alpha-induced antiviral defense by mediating both monomethylation of STAT1 at 'Lys-525' and catalyzing H3K36me3 on promoters of some interferon-stimulated genes (ISGs) to activate gene transcription .  ECO:0000269|PubMed:19141475, ECO:0000269|PubMed:21526191, ECO:0000269|PubMed:21792193, ECO:0000269|PubMed:23043551, ECO:0000269|PubMed:23325844, ECO:0000269|PubMed:23622243, ECO:0000269|PubMed:24509477, ECO:0000269|PubMed:24843002, ECO:0000269|PubMed:27317772, ECO:0000269|PubMed:27474439,","label: attribute=""display name"" labelsize=12 labelAlignment=left outline=true outlineColor=white outlineTransparency=95 outlineWidth=10 background=false color=black dropShadow=false",,"https://version-12-0.string-db.org/images/Proteinpictures/pdb/5j/5jlb_A.png","stringdb","protein","MKQLQPQPPPKMGDFYDPEHPTPEEEENEAKIENVQKTGFIKGPMFKGVASSRFLPKGTKTKVNLEEQGRQKVSFSFSLTKKTLQNRFLTALGNEKQSDTPNPPAVPLQVDSTPKMKMEIGDTLSTAEESSPPKSRVELGKIHFKKHLLHVTSRPLLATTTAVASPPTHAAPLPAVIAESTTVDSPPSSPPPPPPPAQATTLSSPAPVTEPVALPHTPITVLMAAPVPLPVDVAVRSLKEPPIIIVPESLEADTKQDTISNSLEEHVTQILNEQADISSKKEDSHIGKDEEIPDSSKISLSCKKTGSKKKSSQSEGIFLGSESDEDSVRTSSSQRSHDLKFSASIEKERDFKKSSAPLKSEDLGKPSRSKTDRDDKYFSYSKLERDTRYVSSRCRSERERRRSRSHSRSERGSRTNLSYSRSERSHYYDSDRRYHRSSPYRERTRYSRPYTDNRARESSDSEEEYKKTYSRRTSSHSSSYRDLRTSSYSKSDRDCKTETSYLEMERRGKYSSKLERESKRTSENEAIKRCCSPPNELGFRRGSSYSKHDSSASRYKSTLSKPIPKSDKFKNSFCCTELNEEIKQSHSFSLQTPCSKGSELRMINKNPEREKAGSPAPSNRLNDSPTLKKLDELPIFKSEFITHDSHDSIKELDSLSKVKNDQLRSFCPIELNINGSPGAESDLATFCTSKTDAVLMTSDDSVTGSELSPLVKACMLSSNGFQNISRCKEKDLDDTCMLHKKSESPFRETEPLVSPHQDKLMSMPVMTVDYSKTVVKEPVDTRVSCCKTKDSDIYCTLNDSNPSLCNSEAENIEPSVMKISSNSFMNVHLESKPVICDSRNLTDHSKFACEEYKQSIGSTSSASVNHFDDLYQPIGSSGIASSLQSLPPGIKVDSLTLLKCGENTSPVLDAVLKSKKSSEFLKHAGKETIVEVGSDLPDSGKGFASRENRRNNGLSGKCLQEAQEEGNSILPERRGRPEISLDERGEGGHVHTSDDSEVVFSSCDLNLTMEDSDGVTYALKCDSSGHAPEIVSTVHEDYSGSSESSNDESDSEDTDSDDSSIPRNRLQSVVVVPKNSTLPMEETSPCSSRSSQSYRHYSDHWEDERLESRRHLYEEKFESIASKACPQTDKFFLHKGTEKNPEISFTQSSRKQIDNRLPELSHPQSDGVDSTSHTDVKSDPLGHPNSEETVKAKIPSRQQEELPIYSSDFEDVPNKSWQQTTFQNRPDSRLGKTELSFSSSCEIPHVDGLHSSEELRNLGWDFSQEKPSTTYQQPDSSYGACGGHKYQQNAEQYGGTRDYWQGNGYWDPRSGRPPGTGVVYDRTQGQVPDSLTDDREEEENWDQQDGSHFSDQSDKFLLSLQKDKGSVQAPEISSNSIKDTLAVNEKKDFSKNLEKNDIKDRGPLKKRRQEIESDSESDGELQDRKKVRVEVEQGETSVPPGSALVGPSCVMDDFRDPQRWKECAKQGKMPCYFDLIEENVYLTERKKNKSHRDIKRMQCECTPLSKDERAQGEIACGEDCLNRLLMIECSSRCPNGDYCSNRRFQRKQHADVEVILTEKKGWGLRAAKDLPSNTFVLEYCGEVLDHKEFKARVKEYARNKNIHYYFMALKNDEIIDATQKGNCSRFMNHSCEPNCETQKWTVNGQLRVGFFTTKLVPSGSELTFDYQFQRYGKEAQKCFCGSANCRGYLGGENRVSIRAAGGKMKKERSRKKDSVDGELEALMENGEGLSDKNQVLSLSRLMVRIETLEQKLTCLELIQNTHSQSCLKSFLERHGLSLLWIWMAELGDGRESNQKLQEEIIKTLEHLPIPTKNMLEESKVLPIIQRWSQTKTAVPPLSEGDGYSSENTSRAHTPLNTPDPSTKLSTEADTDTPKKLMFRRLKIISENSMDSAISDATSELEGKDGKEDLDQLENVPVEEEEELQSQQLLPQQLPECKVDSETNIEASKLPTSEPEADAEIEPKESNGTKLEEPINEETPSQDEEEGVSDVESERSQEQPDKTVDISDLATKLLDSWKDLKEVYRIPKKSQTEKENTTTERGRDAVGFRDQTPAPKTPNRSRERDPDKQTQNKEKRKRRSSLSPPSSAYERGTKRPDDRYDTPTSKKKVRIKDRNKLSTEERRKLFEQEVAQREAQKQQQQMQNLGMTSPLPYDSLGYNAPHHPFAGYPPGYPMQAYVDPSNPNAGKVLLPTPSMDPVCSPAPYDHAQPLVGHSTEPLSAPPPVPVVPHVAAPVEVSSSQYVAQSDGVVHQDSSVAVLPVPAPGPVQGQNYSVWDSNQQSVSVQQQYSPAQSQATIYYQGQTCPTVYGVTSPYSQTTPPIVQSYAQPSLQYIQGQQIFTAHPQGVVVQPAAAVTTIVAPGQPQPLQPSEMVVTNNLLDLPPPSPPKPKTIVLPPNWKTARDPEGKIYYYHVITRQTQWDPPTWESPGDDASLEHEAEMDLGTPTYDENPMKASKKPKTAEADTSSELAKKSKEVFRKEMSQFIVQCLNPYRKPDCKVGRITTTEDFKHLARKLTHGVMNKELKYCKNPEDLECNENVKHKTKEYIKKYMQKFGAVYKPKEDTELE","Homo sapiens","string:","7ea8,2mdc,7evs,7evr,2mdj,5jlb,2a7o","Tchem","Epigenetic","1.898431","4.564363","1.768613","2.783261","1.605445","0.982271","2.846177","4.571886","3.270327","4.591408","3.974212","2.935759","4.757484","2.052831","1.788355","2.392205","2.952674","2.119795","2.332732","1.309891"
"stringdb:9606.ENSP00000355330","2.146517","4.862769","3.0779","1.479058","4.498098","1.240677","1.758065","5.0","5.0","1.37237","4.641813","TGM2","9606.ENSP00000355330","TGM2","false","9606.ENSP00000355330","P21980","9606.ENSP00000355330","Protein-glutamine gamma-glutamyltransferase 2; Catalyzes the cross-linking of proteins, such as WDR54, and the conjugation of polyamines to proteins. ","label: attribute=""display name"" labelsize=12 labelAlignment=left outline=true outlineColor=white outlineTransparency=95 outlineWidth=10 background=false color=black dropShadow=false",,"https://version-12-0.string-db.org/images/Proteinpictures/pdb/1k/1kv3_A.png","stringdb","protein","MAEELVLERCDLELETNGRDHHTADLCREKLVVRRGQPFWLTLHFEGRNYEASVDSLTFSVVTGPAPSQEAGTKARFPLRDAVEEGDWTATVVDQQDCTLSLQLTTPANAPIGLYRLSLEASTGYQGSSFVLGHFILLFNAWCPADAVYLDSEEERQEYVLTQQGFIYQGSAKFIKNIPWNFGQFEDGILDICLILLDVNPKFLKNAGRDCSRRSSPVYVGRVVSGMVNCNDDQGVLLGRWDNNYGDGVSPMSWIGSVDILRRWKNHGCQRVKYGQCWVFAAVACTVLRCLGIPTRVVTNYNSAHDQNSNLLIEYFRNEFGEIQGDKSEMIWNFHCWVESWMTRPDLQPGYEGWQALDPTPQEKSEGTYCCGPVPVRAIKEGDLSTKYDAPFVFAEVNADVVDWIQQDDGSVHKSINRSLIVGLKISTKSVGRDEREDITHTYKYPEGSSEEREAFTRANHLNKLAEKEETGMAMRIRVGQSMNMGSDFDVFAHITNNTAEEYVCRLLLCARTVSYNGILGPECGTKYLLNLNLEPFSEKSVPLCILYEKYRDCLTESNLIKVRALLVEPVINSYLLAERDLYLENPEIKIRILGEPKQKRKLVAEVSLQNPLPVALEGCTFTVEGAGLTEEQKTVEIPDPVEAGEEVKVRMDLLPLHMGLHKLVVNFESDKLKAVKGFRNVIIGPA","Homo sapiens","string:","1kv3","Tchem","Enzyme","2.352926","4.433216","1.796174","2.376553","3.802203","2.723545","4.711322","3.623337","4.945101","4.910835","4.886898","3.685726","4.938288","4.152738","1.594601","2.730178","2.660687","2.889799","2.79919","2.016541"
"stringdb:9606.ENSP00000332973","2.949999","4.761453","2.518858","1.864305","2.919816","1.567368","1.996145","2.941735","5.0","2.24308","3.699566","SMAD3","9606.ENSP00000332973","SMAD3","false","9606.ENSP00000332973","P84022","9606.ENSP00000332973","Mothers against decapentaplegic homolog 3; Receptor-regulated SMAD (R-SMAD) that is an intracellular signal transducer and transcriptional modulator activated by TGF-beta (transforming growth factor) and activin type 1 receptor kinases. Binds the TRE element in the promoter region of many genes that are regulated by TGF-beta and, on formation of the SMAD3/SMAD4 complex, activates transcription. Also can form a SMAD3/SMAD4/JUN/FOS complex at the AP- 1/SMAD site to regulate TGF-beta-mediated transcription. Has an inhibitory effect on wound healing probably by modulating both growth and migration of primary keratinocytes and by altering the TGF-mediated chemotaxis of monocytes. This effect on wound healing appears to be hormone-sensitive. Regulator of chondrogenesis and osteogenesis and inhibits early healing of bone fractures. Positively regulates PDPK1 kinase activity by stimulating its dissociation from the 14-3-3 protein YWHAQ which acts as a negative regulator. ECO:0000269|PubMed:15241418, ECO:0000269|PubMed:15588252, ECO:0000269|PubMed:16156666, ECO:0000269|PubMed:16751101, ECO:0000269|PubMed:16862174, ECO:0000269|PubMed:17327236, ECO:0000269|PubMed:19218245, ECO:0000269|PubMed:19289081,; Belongs to the dwarfin/SMAD family.","label: attribute=""display name"" labelsize=12 labelAlignment=left outline=true outlineColor=white outlineTransparency=95 outlineWidth=10 background=false color=black dropShadow=false",,"https://version-12-0.string-db.org/images/Proteinpictures/pdb/1u/1u7f_A.png","stringdb","protein","MSSILPFTPPIVKRLLGWKKGEQNGQEEKWCEKAVKSLVKKLKKTGQLDELEKAITTQNVNTKCITIPRSLDGRLQVSHRKGLPHVIYCRLWRWPDLHSHHELRAMELCEFAFNMKKDEVCVNPYHYQRVETPVLPPVLVPRHTEIPAEFPPLDDYSHSIPENTNFPAGIEPQSNIPETPPPGYLSEDGETSDHQMNHSMDAGSPNLSPNPMSPAHNNLDLQPVTYCEPAFWCSISYYELNQRVGETFHASQPSMTVDGFTDPSNSERFCLGLLSNVNRNAAVELTRRHIGRGVRLYYIGGEVFAECLSDSAIFVQSPNCNQRYGWHPATVCKIPPGCNLKIFNNQEFAALLAQSVNQGFEAVYQLTRMCTIRMSFVKGWGAEYRRQTVTSTPCWIELHLNGPLQWLDKVLTQMGSPSIRCSSVS","Homo sapiens","string:","1ozj,2lb2,5od6,1u7f","Tchem","Transcription Factor","2.130741","3.528073","2.607118","2.952122","2.791064","2.132378","3.36593","3.864857","3.957473","3.511378","4.396599","3.646826","4.82788","4.695223","2.043465","3.29318","2.952022","2.764671","2.777841","2.290927"
"stringdb:9606.ENSP00000339527","2.66986","5.0","2.454471","1.91414","2.634688","1.596579","2.656885","5.0","5.0","2.258259","2.688075","FOXO3","9606.ENSP00000339527","FOXO3","false","9606.ENSP00000339527","O43524","9606.ENSP00000339527","Forkhead box protein O3; Transcriptional activator that recognizes and binds to the DNA sequence 5'-[AG]TAAA[TC]A-3' and regulates different processes, such as apoptosis and autophagy (PubMed:10102273, PubMed:16751106, PubMed:21329882). Acts as a positive regulator of autophagy in skeletal muscle: in starved cells, enters the nucleus following dephosphorylation and binds the promoters of autophagy genes, such as GABARAP1L, MAP1LC3B and ATG12, thereby activating their expression, resulting in proteolysis of skeletal muscle proteins (By similarity). Triggers apoptosis in the absence of survival factors, including neuronal cell death upon oxidative stress (PubMed:10102273, PubMed:16751106). Participates in post-transcriptional regulation of MYC: following phosphorylation by MAPKAPK5, promotes induction of miR- 34b and miR-34c expression, 2 post-transcriptional regulators of MYC that bind to the 3'UTR of MYC transcript and prevent its translation . In response to metabolic stress, translocates into the mitochondria where it promotes mtDNA transcription . ECO:0000269|PubMed:10102273, ECO:0000269|PubMed:16751106,","label: attribute=""display name"" labelsize=12 labelAlignment=left outline=true outlineColor=white outlineTransparency=95 outlineWidth=10 background=false color=black dropShadow=false",,"https://version-12-0.string-db.org/images/Proteinpictures/pdb/2k/2k86_A.png","stringdb","protein","MAEAPASPAPLSPLEVELDPEFEPQSRPRSCTWPLQRPELQASPAKPSGETAADSMIPEEEDDEDDEDGGGRAGSAMAIGGGGGSGTLGSGLLLEDSARVLAPGGQDPGSGPATAAGGLSGGTQALLQPQQPLPPPQPGAAGGSGQPRKCSSRRNAWGNLSYADLITRAIESSPDKRLTLSQIYEWMVRCVPYFKDKGDSNSSAGWKNSIRHNLSLHSRFMRVQNEGTGKSSWWIINPDGGKSGKAPRRRAVSMDNSNKYTKSRGRAAKKKAALQTAPESADDSPSQLSKWPGSPTSRSSDELDAWTDFRSRTNSNASTVSGRLSPIMASTELDEVQDDDAPLSPMLYSSSASLSPSVSKPCTVELPRLTDMAGTMNLNDGLTENLMDDLLDNITLPPSQPSPTGGLMQRSSSFPYTTKGSGLGSPTSSFNSTVFGPSSLNSLRQSPMQTIQENKPATFSSMSHYGNQTLQDLLTSDSLSHSDVMMTQSDPLMSQASTAVSAQNSRRNVMLRNDPMMSFAAQPNQGSLVNQNLLHHQHQTQGALGGSRALSNSVSNMGLSESSSLGSAKHQQQSPVSQSMQTLSDSLSGSSLYSTSANLPVMGHEKFPSDLDLDMFNGSLECDMESIIRSELMDADGLDFNFDSLISTQNVVGLNVGNFTGAKQASSQSWVPG","Homo sapiens","string:","6mnl,2k86,2lqi","Tbio","Transcription Factor","2.686121","3.469657","2.370904","3.148192","4.006962","2.036839","3.269116","3.146302","3.097399","3.164033","3.313989","4.718282","4.606015","3.124947","2.120232","2.804084","2.854409","4.525542","2.65951","1.865887"
