"@id","compartment::cytoskeleton","compartment::cytosol","compartment::endoplasmic reticulum","compartment::endosome","compartment::extracellular","compartment::golgi apparatus","compartment::lysosome","compartment::mitochondrion","compartment::nucleus","compartment::peroxisome","compartment::plasma membrane","display name","name","query term","selected","shared name","stringdb::canonical name","stringdb::database identifier","stringdb::description","stringdb::enhancedLabel Passthrough","stringdb::full name","stringdb::imageurl","stringdb::namespace","stringdb::node type","stringdb::sequence","stringdb::species","stringdb::STRING style","stringdb::structures","target::development level","target::family","tissue::adrenal gland","tissue::blood","tissue::bone","tissue::bone marrow","tissue::eye","tissue::gall bladder","tissue::heart","tissue::intestine","tissue::kidney","tissue::liver","tissue::lung","tissue::muscle","tissue::nervous system","tissue::pancreas","tissue::saliva","tissue::skin","tissue::spleen","tissue::stomach","tissue::thyroid gland","tissue::urine"
"stringdb:9606.ENSP00000444408","1.790204","2.196197","1.816367","1.600465","4.470426","2.953296","1.981351","2.495138","2.360413","1.53698","4.88775","SLC1A5","9606.ENSP00000444408","SLC1A5","false","9606.ENSP00000444408","Q9BWQ3","9606.ENSP00000444408","Neutral amino acid transporter B(0); Sodium-dependent amino acids transporter that has a broad substrate specificity, with a preference for zwitterionic amino acids. It accepts as substrates all neutral amino acids, including glutamine, asparagine, and branched-chain and aromatic amino acids, and excludes methylated, anionic, and cationic amino acids (PubMed:8702519, PubMed:29872227). Through binding of the fusogenic protein syncytin- 1/ERVW-1 may mediate trophoblasts syncytialization, the spontaneous fusion of their plasma membranes, an essential process in placental development .  (Microbial infection) Acts as a cell surface receptor for Baboon M7 endogenous virus.","label: attribute=""display name"" labelsize=12 labelAlignment=left outline=true outlineColor=white outlineTransparency=95 outlineWidth=10 background=false color=black dropShadow=false",,"https://version-12-0.string-db.org/images/Proteinpictures/pdb/7b/7bct_A.png","stringdb","protein","MVADPPRDSKGLAAAEPTANGGLALASIEDQGAAAGGYCGSRDQVRRCLRANLLVLLTVVAVVAGVALGLGVSGAGGALALGPERLSAFVFPGELLLRLLRMIILPLVVCSLIGGAASLDPGALGRLGAWALLFFLVTTLLASALGVGLALALQPGAASAAINASVGAAGSAENAPSKEVLDSFLDLARNIFPSNLVSAAFRSYSTTYEERNITGTRVKVPVGQEVEGMNILGLVVFAIVFGVALRKLGPEGELLIRFFNSFNEATMVLVSWIMWYAPVGIMFLVAGKIVEMEDVGLLFARLGKYILCCLLGHAIHGLLVLPLIYFLFTRKNPYRFLWGIVTPLATAFGTSSSSATLPLMMKCVEENNGVAKHISRFILPIGATVNMDGAALFQCVAAVFIAQLSQQSLDFVKIITILVTATASSVGAAGIPAGGVLTLAIILEAVNLPVDHISLILAVDWLVDRSCTVLNVEGDALGAGLLQNYVDRTESRSTEPELIQVKSELPLDPLPVPTEEGNPLLKHYRGPAGDATVASEKESVM","Homo sapiens","string:","7bct","Tchem","Transporter","1.76418","3.207728","1.515515","2.586134","2.935241","1.39678","2.397555","4.473311","4.662142","3.071744","3.852523","2.396598","3.878008","3.207419","2.309772","3.247827","2.513501","2.461799","1.772793","1.626682"
"stringdb:9606.ENSP00000364802","5.0","5.0","5.0","1.391467","4.413934","1.233521","1.750345","5.0","5.0","1.165989","1.984856","HSPA1A","9606.ENSP00000364802","HSPA1A","false","9606.ENSP00000364802",,"9606.ENSP00000364802","Heat shock protein family A member 1A","label: attribute=""display name"" labelsize=12 labelAlignment=left outline=true outlineColor=white outlineTransparency=95 outlineWidth=10 background=false color=black dropShadow=false",,,"stringdb","protein","MAKAAAIGIDLGTTYSCVGVFQHGKVEIIANDQGNRTTPSYVAFTDTERLIGDAAKNQVALNPQNTVFDAKRLIGRKFGDPVVQSDMKHWPFQVINDGDKPKVQVSYKGETKAFYPEEISSMVLTKMKEIAEAYLGYPVTNAVITVPAYFNDSQRQATKDAGVIAGLNVLRIINEPTAAAIAYGLDRTGKGERNVLIFDLGGGTFDVSILTIDDGIFEVKATAGDTHLGGEDFDNRLVNHFVEEFKRKHKKDISQNKRAVRRLRTACERAKRTLSSSTQASLEIDSLFEGIDFYTSITRARFEELCSDLFRSTLEPVEKALRDAKLDKAQIHDLVLVGGSTRIPKVQKLLQDFFNGRDLNKSINPDEAVAYGAAVQAAILMGDKSENVQDLLLLDVAPLSLGLETAGGVMTALIKRNSTIPTKQTQIFTTYSDNQPGVLIQVYEGERAMTKDNNLLGRFELSGIPPAPRGVPQIEVTFDIDANGILNVTATDKSTGKANKITITNDKGRLSKEEIERMVQEAEKYKAEDEVQRERVSAKNALESYAFNMKSAVEDEGLKGKISEADKKKVLDKCQEVISWLDANTLAEKDEFEHKRKELEQVCNPIISGLYQGAGGPGPGGFGAQGPKGGSGSGPTIEEVD","Homo sapiens","string:",,,,"2.50556","4.609968","1.641138","2.858473","3.728474","1.016667","4.739908","4.877541","4.80436","4.884868","4.956001","4.807205","4.997619","4.917465","1.588643","4.857815","4.918507","4.030296","3.622303","1.746667"
"stringdb:9606.ENSP00000376197","2.920671","3.451907","2.71159","5.0","5.0","2.65673","3.012254","2.935481","3.034697","1.599529","5.0","TFRC","9606.ENSP00000376197","TFRC","false","9606.ENSP00000376197","P02786","9606.ENSP00000376197","Transferrin receptor protein 1, serum form; Cellular uptake of iron occurs via receptor-mediated endocytosis of ligand-occupied transferrin receptor into specialized endosomes. Endosomal acidification leads to iron release. The apotransferrin-receptor complex is then recycled to the cell surface with a return to neutral pH and the concomitant loss of affinity of apotransferrin for its receptor. Transferrin receptor is necessary for development of erythrocytes and the nervous system (By similarity). A second ligand, the heditary hemochromatosis protein HFE, competes for binding with transferrin for an overlapping C-terminal binding site. Positively regulates T and B cell proliferation through iron uptake ; Belongs to the peptidase M28 family. M28B subfamily. ","label: attribute=""display name"" labelsize=12 labelAlignment=left outline=true outlineColor=white outlineTransparency=95 outlineWidth=10 background=false color=black dropShadow=false",,"https://version-12-0.string-db.org/images/Proteinpictures/pdb/7z/7zqs_B.png","stringdb","protein","MMDQARSAFSNLFGGEPLSYTRFSLARQVDGDNSHVEMKLAVDEEENADNNTKANVTKPKRCSGSICYGTIAVIVFFLIGFMIGYLGYCKGVEPKTECERLAGTESPVREEPGEDFPAARRLYWDDLKRKLSEKLDSTDFTGTIKLLNENSYVPREAGSQKDENLALYVENQFREFKLSKVWRDQHFVKIQVKDSAQNSVIIVDKNGRLVYLVENPGGYVAYSKAATVTGKLVHANFGTKKDFEDLYTPVNGSIVIVRAGKITFAEKVANAESLNAIGVLIYMDQTKFPIVNAELSFFGHAHLGTGDPYTPGFPSFNHTQFPPSRSSGLPNIPVQTISRAAAEKLFGNMEGDCPSDWKTDSTCRMVTSESKNVKLTVSNVLKEIKILNIFGVIKGFVEPDHYVVVGAQRDAWGPGAAKSGVGTALLLKLAQMFSDMVLKDGFQPSRSIIFASWSAGDFGSVGATEWLEGYLSSLHLKAFTYINLDKAVLGTSNFKVSASPLLYTLIEKTMQNVKHPVTGQFLYQDSNWASKVEKLTLDNAAFPFLAYSGIPAVSFCFCEDTDYPYLGTTMDTYKELIERIPELNKVARAAAEVAGQFVIKLTHDVELNLDYERYNSQLLSFVRDLNQYRADIKEMGLSLQWLYSARGDFFRATSRLTTDFGNAEKTDRFVMKKLNDRVMRVEYHFLSPYVSPKESPFRHVFWGSGSHTLPALLENLKLRKQNNGAFNETLFRNQLALATWTIQGAANALSGDVWDIDNEF","Homo sapiens","string:","6w3h,7zqs,1de4,6y76","Tbio","Other","2.738856","4.240931","2.419114","4.752037","4.685892","1.970148","3.59595","4.247565","3.730539","4.885585","3.691497","3.1336","4.948967","3.121704","2.201173","3.298526","3.568034","2.801785","2.644075","2.187594"
"stringdb:9606.ENSP00000223095","2.708321","3.496963","2.247293","1.788587","5.0","1.55985","2.326296","2.566399","2.996404","2.314034","4.571399","SERPINE1","9606.ENSP00000223095","SERPINE1","false","9606.ENSP00000223095","P05121","9606.ENSP00000223095","Plasminogen activator inhibitor 1; Serine protease inhibitor. Inhibits TMPRSS7 . Is a primary inhibitor of tissue-type plasminogen activator (PLAT) and urokinase-type plasminogen activator (PLAU). As PLAT inhibitor, it is required for fibrinolysis down-regulation and is responsible for the controlled degradation of blood clots . As PLAU inhibitor, it is involved in the regulation of cell adhesion and spreading . Acts as a regulator of cell migration, independently of its role as protease inhibitor . It is required for stimulation of keratinocyte migration during cutaneous injury repair . It is involved in cellular and replicative senescence . Plays a role in alveolar type 2 cells senescence in the lung (By similarity). Is involved in the regulation of cementogenic differentiation of periodontal ligament stem cells, and regulates odontoblast differentiation and dentin formation during odontogenesis .  ECO:0000269|PubMed:15853774, ECO:0000269|PubMed:16862142, ECO:0000269|PubMed:17912461, ECO:0000269|PubMed:18386027, ECO:0000269|PubMed:25808697, ECO:0000269|PubMed:27046084, ECO:0000269|PubMed:8481516, ECO:0000269|PubMed:9168821,; Belongs to the serpin family.","label: attribute=""display name"" labelsize=12 labelAlignment=left outline=true outlineColor=white outlineTransparency=95 outlineWidth=10 background=false color=black dropShadow=false",,"https://version-12-0.string-db.org/images/Proteinpictures/pdb/6i/6i8s_A.png","stringdb","protein","MQMSPALTCLVLGLALVFGEGSAVHHPPSYVAHLASDFGVRVFQQVAQASKDRNVVFSPYGVASVLAMLQLTTGGETQQQIQAAMGFKIDDKGMAPALRHLYKELMGPWNKDEISTTDAIFVQRDLKLVQGFMPHFFRLFRSTVKQVDFSEVERARFIINDWVKTHTKGMISNLLGKGAVDQLTRLVLVNALYFNGQWKTPFPDSSTHRRLFHKSDGSTVSVPMMAQTNKFNYTEFTTPDGHYYDILELPYHGDTLSMFIAAPYEKEVPLSALTNILSAQLISHWKGNMTRLPRLLVLPKFSLETEVDLRKPLENLGMTDMFRQFQADFTSLSDQEPLHVAQALQKVKIEVNESGTVASSSTAVIVSARMAPEEIIMDRPFLFVVRHNPTGTVLFMGQVMEP","Homo sapiens","string:","9pai,6i8s","Tchem","Other","2.995024","3.831747","3.496314","2.379967","2.871135","3.080538","3.795786","3.405109","3.411701","4.426959","4.868927","3.307117","3.684578","4.217876","1.72149","4.634557","2.839877","2.517361","2.767332","2.629583"
"stringdb:9606.ENSP00000331602","2.071182","4.742242","5.0","5.0","4.426498","2.62762","5.0","3.932873","5.0","1.315938","5.0","PRKCD","9606.ENSP00000331602","PRKCD","false","9606.ENSP00000331602","Q05655","9606.ENSP00000331602","Protein kinase C delta type regulatory subunit; Calcium-independent, phospholipid- and diacylglycerol (DAG)- dependent serine/threonine-protein kinase that plays contrasting roles in cell death and cell survival by functioning as a pro-apoptotic protein during DNA damage-induced apoptosis, but acting as an anti- apoptotic protein during cytokine receptor-initiated cell death, is involved in tumor suppression as well as survival of several cancers, is required for oxygen radical production by NADPH oxidase and acts as positive or negative regulator in platelet functional responses. Negatively regulates B cell proliferation and also has an important function in self-antigen induced B cell tolerance induction. Upon DNA damage, activates the promoter of the death-promoting transcription factor BCLAF1/Btf to trigger BCLAF1-mediated p53/TP53 gene transcription and apoptosis. In response to oxidative stress, interact with and activate CHUK/IKKA in the nucleus, causing the phosphorylation of p53/TP53. In the case of ER stress or DNA damage-induced apoptosis, can form a complex with the tyrosine-protein kinase ABL1 which trigger apoptosis independently of p53/TP53. In cytosol can trigger apoptosis by activating MAPK11 or MAPK14, inhibiting AKT1 and decreasing the level of X-linked inhibitor of apoptosis protein (XIAP), whereas in nucleus induces apoptosis via the activation of MAPK8 or MAPK9. Upon ionizing radiation treatment, is required for the activation of the apoptosis regulators BAX and BAK, which trigger the mitochondrial cell death pathway. Can phosphorylate MCL1 and target it for degradation which is sufficient to trigger for BAX activation and apoptosis. Is required for the control of cell cycle progression both at G1/S and G2/M phases. Mediates phorbol 12-myristate 13-acetate (PMA)-induced inhibition of cell cycle progression at G1/S phase by up-regulating the CDK inhibitor CDKN1A/p21 and inhibiting the cyclin CCNA2 promoter activity. In response to UV irradiation can phosphorylate CDK1, which is important for the G2/M DNA damage checkpoint activation. Can protect glioma cells from the apoptosis induced by TNFSF10/TRAIL, probably by inducing increased phosphorylation and subsequent activation of AKT1. Is highly expressed in a number of cancer cells and promotes cell survival and resistance against chemotherapeutic drugs by inducing cyclin D1 (CCND1) and hyperphosphorylation of RB1, and via several pro- survival pathways, including NF-kappa-B, AKT1 and MAPK1/3 (ERK1/2). Can also act as tumor suppressor upon mitogenic stimulation with PMA or TPA. In N-formyl-methionyl-leucyl-phenylalanine (fMLP)-treated cells, is required for NCF1 (p47-phox) phosphorylation and activation of NADPH oxidase activity, and regulates TNF-elicited superoxide anion production in neutrophils, by direct phosphorylation and activation of NCF1 or indirectly through MAPK1/3 (ERK1/2) signaling pathways. May also play a role in the regulation of NADPH oxidase activity in eosinophil after stimulation with IL5, leukotriene B4 or PMA. In collagen-induced platelet aggregation, acts a negative regulator of filopodia formation and actin polymerization by interacting with and negatively regulating VASP phosphorylation. Downstream of PAR1, PAR4 and CD36/GP4 receptors, regulates differentially platelet dense granule secretion; acts as a positive regulator in PAR-mediated granule secretion, whereas it negatively regulates CD36/GP4-mediated granule release. Phosphorylates MUC1 in the C-terminal and regulates the interaction between MUC1 and beta-catenin. The catalytic subunit phosphorylates 14-3-3 proteins (YWHAB, YWHAZ and YWHAH) in a sphingosine-dependent fashion (By similarity). Phosphorylates ELAVL1 in response to angiotensin-2 treatment . ECO:0000269|PubMed:11748588, ECO:0000269|PubMed:11877440, ECO:0000269|PubMed:15774464, ECO:0000269|PubMed:16940418, ECO:0000269|PubMed:18285462, ECO:0000269|PubMed:19587372,","label: attribute=""display name"" labelsize=12 labelAlignment=left outline=true outlineColor=white outlineTransparency=95 outlineWidth=10 background=false color=black dropShadow=false",,"https://version-12-0.string-db.org/images/Proteinpictures/pdb/1y/1yrk_A.png","stringdb","protein","MAPFLRIAFNSYELGSLQAEDEANQPFCAVKMKEALSTERGKTLVQKKPTMYPEWKSTFDAHIYEGRVIQIVLMRAAEEPVSEVTVGVSVLAERCKKNNGKAEFWLDLQPQAKVLMSVQYFLEDVDCKQSMRSEDEAKFPTMNRRGAIKQAKIHYIKNHEFIATFFGQPTFCSVCKDFVWGLNKQGYKCRQCNAAIHKKCIDKIIGRCTGTAANSRDTIFQKERFNIDMPHRFKVHNYMSPTFCDHCGSLLWGLVKQGLKCEDCGMNVHHKCREKVANLCGINQKLLAEALNQVTQRASRRSDSASSEPVGIYQGFEKKTGVAGEDMQDNSGTYGKIWEGSSKCNINNFIFHKVLGKGSFGKVLLGELKGRGEYFAIKALKKDVVLIDDDVECTMVEKRVLTLAAENPFLTHLICTFQTKDHLFFVMEFLNGGDLMYHIQDKGRFELYRATFYAAEIMCGLQFLHSKGIIYRDLKLDNVLLDRDGHIKIADFGMCKENIFGESRASTFCGTPDYIAPEILQGLKYTFSVDWWSFGVLLYEMLIGQSPFHGDDEDELFESIRVDTPHYPRWITKESKDILEKLFEREPTKRLGVTGNIKIHPFFKTINWTLLEKRRLEPPFRPKVKSPRDYSNFDQEFLNEKARLSYSDKNLIDSMDQSAFAGFSFVNPKFEHLLED","Homo sapiens","string:","7l92,1yrk,2yuu","Tclin","Kinase","2.59605","4.64361","1.731888","2.61326","1.952029","1.284807","2.663057","2.768403","2.770198","4.500705","2.865708","2.635528","4.587583","2.405175","2.149323","4.515529","2.57523","2.451079","2.253657","1.746229"
"stringdb:9606.ENSP00000376352","1.75075","2.18672","1.672026","0.975244","2.11096","0.77023","1.544821","4.809522","2.223654","1.664957","2.00127","PDK1","9606.ENSP00000376352","PDK1","false","9606.ENSP00000376352","Q15118","9606.ENSP00000376352","[Pyruvate dehydrogenase (acetyl-transferring)] kinase isozyme 1, mitochondrial; Kinase that plays a key role in regulation of glucose and fatty acid metabolism and homeostasis via phosphorylation of the pyruvate dehydrogenase subunits PDHA1 and PDHA2. This inhibits pyruvate dehydrogenase activity, and thereby regulates metabolite flux through the tricarboxylic acid cycle, down-regulates aerobic respiration and inhibits the formation of acetyl-coenzyme A from pyruvate. Plays an important role in cellular responses to hypoxia and is important for cell proliferation under hypoxia. Protects cells against apoptosis in response to hypoxia and oxidative stress. ECO:0000269|PubMed:18541534, ECO:0000269|PubMed:22195962,","label: attribute=""display name"" labelsize=12 labelAlignment=left outline=true outlineColor=white outlineTransparency=95 outlineWidth=10 background=false color=black dropShadow=false",,"https://version-12-0.string-db.org/images/Proteinpictures/pdb/2q/2q8g_A.png","stringdb","protein","MRLARLLRGAALAGPGPGLRAAGFSRSFSSDSGSSPASERGVPGQVDFYARFSPSPLSMKQFLDFGSVNACEKTSFMFLRQELPVRLANIMKEISLLPDNLLRTPSVQLVQSWYIQSLQELLDFKDKSAEDAKAIYERPRRTWLQVSSLCCMACKMIFTDTVIRIRNRHNDVIPTMAQGVIEYKESFGVDPVTSQNVQYFLDRFYMSRISIRMLLNQHSLLFGGKGKGSPSHRKHIGSINPNCNVLEVIKDGYENARRLCDLYYINSPELELEELNAKSPGQPIQVVYVPSHLYHMVFELFKNAMRATMEHHANRGVYPPIQVHVTLGNEDLTVKMSDRGGGVPLRKIDRLFNYMYSTAPRPRVETSRAVPLAGFGYGLPISRLYAQYFQGDLKLYSLEGYGTDAVIYIKALSTDSIERLPVYNKAAWKHYNTNHEADDWCVPSREPKDMTTFRSA","Homo sapiens","string:","2q8g","Tchem","Kinase","1.838625","2.665105","1.444281","2.174371","1.798869","1.269115","2.870573","2.676309","2.646741","4.511318","2.585747","2.818562","2.696424","2.195106","0.799769","4.436624","2.307385","1.992782","1.786025","1.049218"
"stringdb:9606.ENSP00000435412","2.443353","4.84421","1.997853","1.760973","2.272765","1.435581","1.951167","2.260329","5.0","1.408177","2.436268","RPS6KA1","9606.ENSP00000435412","RPS6KA1","false","9606.ENSP00000435412","Q96C05","9606.ENSP00000435412","Ribosomal protein S6 kinase alpha-1; Serine/threonine-protein kinase that acts downstream of ERK (MAPK1/ERK2 and MAPK3/ERK1) signaling and mediates mitogenic and stress-induced activation of the transcription factors CREB1, ETV1/ER81 and NR4A1/NUR77, regulates translation through RPS6 and EIF4B phosphorylation, and mediates cellular proliferation, survival, and differentiation by modulating mTOR signaling and repressing pro- apoptotic function of BAD and DAPK1. In fibroblast, is required for EGF-stimulated phosphorylation of CREB1, which results in the subsequent transcriptional activation of several immediate-early genes. In response to mitogenic stimulation (EGF and PMA), phosphorylates and activates NR4A1/NUR77 and ETV1/ER81 transcription factors and the cofactor CREBBP. Upon insulin-derived signal, acts indirectly on the transcription regulation of several genes by phosphorylating GSK3B at 'Ser-9' and inhibiting its activity. Phosphorylates RPS6 in response to serum or EGF via an mTOR-independent mechanism and promotes translation initiation by facilitating assembly of the pre-initiation complex. In response to insulin, phosphorylates EIF4B, enhancing EIF4B affinity for the EIF3 complex and stimulating cap-dependent translation. Is involved in the mTOR nutrient-sensing pathway by directly phosphorylating TSC2 at 'Ser-1798', which potently inhibits TSC2 ability to suppress mTOR signaling, and mediates phosphorylation of RPTOR, which regulates mTORC1 activity and may promote rapamycin-sensitive signaling independently of the PI3K/AKT pathway. Mediates cell survival by phosphorylating the pro-apoptotic proteins BAD and DAPK1 and suppressing their pro-apoptotic function. Promotes the survival of hepatic stellate cells by phosphorylating CEBPB in response to the hepatotoxin carbon tetrachloride (CCl4). Mediates induction of hepatocyte prolifration by TGFA through phosphorylation of CEBPB (By similarity). Is involved in cell cycle regulation by phosphorylating the CDK inhibitor CDKN1B, which promotes CDKN1B association with 14-3-3 proteins and prevents its translocation to the nucleus and inhibition of G1 progression. Phosphorylates EPHA2 at 'Ser-897', the RPS6KA-EPHA2 signaling pathway controls cell migration .  ECO:0000269|PubMed:10679322, ECO:0000269|PubMed:11684016, ECO:0000269|PubMed:12213813, ECO:0000269|PubMed:15117958, ECO:0000269|PubMed:15342917, ECO:0000269|PubMed:16213824, ECO:0000269|PubMed:16223362, ECO:0000269|PubMed:16763566, ECO:0000269|PubMed:17360704, ECO:0000269|PubMed:18722121,","label: attribute=""display name"" labelsize=12 labelAlignment=left outline=true outlineColor=white outlineTransparency=95 outlineWidth=10 background=false color=black dropShadow=false",,"https://version-12-0.string-db.org/images/Proteinpictures/pdb/4n/4nif_A.png","stringdb","protein","MEQDPKPPRLRLWALIPWLPRKQRPRISQTSLPVPGPGSGPQRDSDEGVLKEISITHHVKAGSEKADPSHFELLKVLGQGSFGKVFLVRKVTRPDSGHLYAMKVLKKATLKVRDRVRTKMERDILADVNHPFVVKLHYAFQTEGKLYLILDFLRGGDLFTRLSKEVMFTEEDVKFYLAELALGLDHLHSLGIIYRDLKPENILLDEEGHIKLTDFGLSKEAIDHEKKAYSFCGTVEYMAPEVVNRQGHSHSADWWSYGVLMFEMLTGSLPFQGKDRKETMTLILKAKLGMPQFLSTEAQSLLRALFKRNPANRLGSGPDGAEEIKRHVFYSTIDWNKLYRREIKPPFKPAVAQPDDTFYFDTEFTSRTPKDSPGIPPSAGAHQLFRGFSFVATGLMEDDGKPRAPQAPLHSVVQQLHGKNLVFSDGYVVKETIGVGSYSECKRCVHKATNMEYAVKVIDKSKRDPSEEIEILLRYGQHPNIITLKDVYDDGKHVYLVTELMRGGELLDKILRQKFFSEREASFVLHTIGKTVEYLHSQGVVHRDLKPSNILYVDESGNPECLRICDFGFAKQLRAENGLLMTPCYTANFVAPEVLKRQGYDEGCDIWSLGILLYTMLAGYTPFANGPSDTPEEILTRIGSGKFTLSGGNWNTVSETAKDLVSKMLHVDPHQRLTAKQVLQHPWVTQKDKLPQSQLSHQDLQLVKGAMAATYSALNSSKPTPQLKPIESSILAQRRVRKLPSTTL","Homo sapiens","string:","5csj,5csi,4nif,5csn,3tei,5csf,5v61,5v62,2z7r","Tchem","Kinase","2.727939","3.263373","1.824965","2.62387","2.081411","1.742386","2.706997","4.659373","2.936795","4.551743","3.199559","2.722378","3.052765","2.632064","2.145025","2.717346","2.668084","2.573233","4.488143","1.206525"
"stringdb:9606.ENSP00000366702","1.504511","4.599073","1.186439","1.149187","1.657421",,"1.288239","1.653172","4.190938",,"4.293378","ERRFI1","9606.ENSP00000366702","ERRFI1","false","9606.ENSP00000366702","Q9UJM3","9606.ENSP00000366702","ERBB receptor feedback inhibitor 1; Negative regulator of EGFR signaling in skin morphogenesis. Acts as a negative regulator for several EGFR family members, including ERBB2, ERBB3 and ERBB4. Inhibits EGFR catalytic activity by interfering with its dimerization. Inhibits autophosphorylation of EGFR, ERBB2 and ERBB4. Important for normal keratinocyte proliferation and differentiation. Plays a role in modulating the response to steroid hormones in the uterus. Required for normal response to progesterone in the uterus and for fertility. Mediates epithelial estrogen responses in the uterus by regulating ESR1 levels and activation. Important for regulation of endometrium cell proliferation. Important for normal prenatal and perinatal lung development (By similarity); Belongs to the MIG6 family.","label: attribute=""display name"" labelsize=12 labelAlignment=left outline=true outlineColor=white outlineTransparency=95 outlineWidth=10 background=false color=black dropShadow=false",,"https://version-12-0.string-db.org/images/Proteinpictures/pdb/4z/4zjv_D.png","stringdb","protein","MSIAGVAAQEIRVPLKTGFLHNGRAMGNMRKTYWSSRSEFKNNFLNIDPITMAYSLNSSAQERLIPLGHASKSAPMNGHCFAENGPSQKSSLPPLLIPPSENLGPHEEDQVVCGFKKLTVNGVCASTPPLTPIKNSPSLFPCAPLCERGSRPLPPLPISEALSLDDTDCEVEFLTSSDTDFLLEDSTLSDFKYDVPGRRSFRGCGQINYAYFDTPAVSAADLSYVSDQNGGVPDPNPPPPQTHRRLRRSHSGPAGSFNKPAIRISNCCIHRASPNSDEDKPEVPPRVPIPPRPVKPDYRRWSAEVTSSTYSDEDRPPKVPPREPLSPSNSRTPSPKSLPSYLNGVMPPTQSFAPDPKYVSSKALQRQNSEGSASKVPCILPIIENGKKVSSTHYYLLPERPPYLDKYEKFFREAEETNGGAQIQPLPADCGISSATEKPDSKTKMDLGGHVKRKHLSYVVSP","Homo sapiens","string:","2rfe,4zjv,2rfd,4i21","Tbio","Other","1.929648","1.671231","1.452094","1.197408","0.475876","2.694729","2.078482","2.79385","3.47568","4.820992","3.068406","2.174486","3.30847","2.98046","1.347655","2.056481","1.630739","2.021588","2.218294","1.43029"
