"stringdb:9606.ENSP00000422793","3.076288","4.473842","1.013952","1.720622","1.562716","0.890651","1.21177","1.682662","2.451021","0.265625","2.084936","INPP4B","9606.ENSP00000422793","INPP4B","false","9606.ENSP00000422793","O15327","9606.ENSP00000422793","Inositol polyphosphate 4-phosphatase type II; Catalyzes the hydrolysis of the 4-position phosphate of phosphatidylinositol 3,4-bisphosphate, inositol 1,3,4-trisphosphate and inositol 3,4-trisphosphate . Plays a role in the late stages of macropinocytosis by dephosphorylating phosphatidylinositol 3,4-bisphosphate in membrane ruffles . The lipid phosphatase activity is critical for tumor suppressor function. Antagonizes the PI3K-AKT/PKB signaling pathway by dephosphorylating phosphoinositides and thereby modulating cell cycle progression and cell survival . ","label: attribute=""display name"" labelsize=12 labelAlignment=left outline=true outlineColor=white outlineTransparency=95 outlineWidth=10 background=false color=black dropShadow=false",,"https://version-12-0.string-db.org/images/Proteinpictures/sm/4c3/4c30b37bcb98c8f9d0361b36.png","stringdb","protein","MEIKEEGASEEGQHFLPTAQANDPGDCQFTSIQKTPNEPQLEFILACKDLVAPVRDRKLNTLVQISVIHPVEQSLTRYSSTEIVEGTRDPLFLTGVTFPSEYPIYEETKIKLTVYDVKDKSHDTVRTSVLPEHKDPPPEVGRSFLGYASFKVGELLKSKEQLLVLSLRTSDGGKVVGTIEVSVVKMGEIEDGEADHITTDVQGQKCALVCECTAPESVSGKDNLPFLNSVLKNPVCKLYRFPTSDNKWMRIREQMSESILSFHIPKELISLHIKEDLCRNQEIKELGELSPHWDNLRKNVLTHCDQMVNMYQDILTELSKETGSSFKSSSSKGEKTLEFVPINLHLQRMQVHSPHLKDALYDVITVGAPAAHFQGFKNGGLRKLLHRFETERRNTGYQFIYYSPENTAKAKEVLSNINQLQPLIATHADLLLNSASQHSPDSLKNSLKMLSEKTELFVHAFKDQLVRSALLALYTARPGGILKKPPSPKSSTEESSPQDQPPVMRGQDSIPHHSDYDEEEWDRVWANVGKSLNCIIAMVDKLIERDGGSEGSGGNNDGEKEPSLTDAIPSHPREDWYEQLYPLILTLKDCMGEVVNRAKQSLTFVLLQELAYSLPQCLMLTLRRDIVFSQALAGLVCGFIIKLQTSLYDPGFLQQLHTVGLIVQYEGLLSTYSDEIGMLEDMAVGISDLKKVAFKIIEAKSNDVLPVITGRREHYVVEVKLPARMFESLPLQIKEGQLLHVYPVLFNVGINEQQTLAERFGDVSLQESINQENFELLQEYYKIFMEKMPPDYISHFQEQNDLKALLENLLQNIQSKKRKNVEIMWLAATICRKLNGIRFTCCKSAKDRTSMSVTLEQCSILRDEHQLHKDFFIRALDCMRSRQTQGALNESDDPETGCLTDNKPTSRHFYPVALLLVSSHLLVVWLILSLALLLAKYQ","Homo sapiens","string:","","Tbio","Enzyme","1.138118","2.639132","0.918848","1.453393","1.146631","1.268409","2.408722","2.040648","1.930763","1.660323","2.180454","2.113124","4.529351","1.647637","1.001592","4.396186","1.844406","1.289071","1.780417","1.046625"
"stringdb:9606.ENSP00000357459","1.964073","3.089825","1.776052","1.810769","2.087982","1.348756","1.552326","2.050271","5.0","0.903171","2.088078","ADAR","9606.ENSP00000357459","ADAR","false","9606.ENSP00000357459","P55265","9606.ENSP00000357459","Double-stranded RNA-specific adenosine deaminase; Catalyzes the hydrolytic deamination of adenosine to inosine in double-stranded RNA (dsRNA) referred to as A-to-I RNA editing . This may affect gene expression and function in a number of ways that include mRNA translation by changing codons and hence the amino acid sequence of proteins; pre-mRNA splicing by altering splice site recognition sequences; RNA stability by changing sequences involved in nuclease recognition; genetic stability in the case of RNA virus genomes by changing sequences during viral RNA replication; and RNA structure- dependent activities such as microRNA production or targeting or protein-RNA interactions. Can edit both viral and cellular RNAs and can edit RNAs at multiple sites (hyper-editing) or at specific sites (site- specific editing). Its cellular RNA substrates include: bladder cancer- associated protein (BLCAP), neurotransmitter receptors for glutamate (GRIA2) and serotonin (HTR2C) and GABA receptor (GABRA3). Site-specific RNA editing of transcripts encoding these proteins results in amino acid substitutions which consequently alters their functional activities. Exhibits low-level editing at the GRIA2 Q/R site, but edits efficiently at the R/G site and HOTSPOT1. Its viral RNA substrates include: hepatitis C virus (HCV), vesicular stomatitis virus (VSV), measles virus (MV), hepatitis delta virus (HDV), and human immunodeficiency virus type 1 (HIV-1). Exhibits either a proviral (HDV, MV, VSV and HIV-1) or an antiviral effect (HCV) and this can be editing-dependent (HDV and HCV), editing-independent (VSV and MV) or both (HIV-1). Impairs HCV replication via RNA editing at multiple sites. Enhances the replication of MV, VSV and HIV-1 through an editing-independent mechanism via suppression of EIF2AK2/PKR activation and function. Stimulates both the release and infectivity of HIV-1 viral particles by an editing-dependent mechanism where it associates with viral RNAs and edits adenosines in the 5'UTR and the Rev and Tat coding sequence. Can enhance viral replication of HDV via A-to-I editing at a site designated as amber/W, thereby changing an UAG amber stop codon to an UIG tryptophan (W) codon that permits synthesis of the large delta antigen (L-HDAg) which has a key role in the assembly of viral particles. However, high levels of ADAR1 inhibit HDV replication.  ECO:0000269|PubMed:15858013, ECO:0000269|PubMed:16120648, ECO:0000269|PubMed:16475990, ECO:0000269|PubMed:17079286, ECO:0000269|PubMed:19605474, ECO:0000269|PubMed:19651874, ECO:0000269|PubMed:19710021, ECO:0000269|PubMed:19908260, ECO:0000269|PubMed:21289159, ECO:0000269|PubMed:22278222,","label: attribute=""display name"" labelsize=12 labelAlignment=left outline=true outlineColor=white outlineTransparency=95 outlineWidth=10 background=false color=black dropShadow=false",,"https://version-12-0.string-db.org/images/Proteinpictures/pdb/2m/2mdr_A.png","stringdb","protein","MNPRQGYSLSGYYTHPFQGYEHRQLRYQQPGPGSSPSSFLLKQIEFLKGQLPEAPVIGKQTPSLPPSLPGLRPRFPVLLASSTRGRQVDIRGVPRGVHLRSQGLQRGFQHPSPRGRSLPQRGVDCLSSHFQELSIYQDQEQRILKFLEELGEGKATTAHDLSGKLGTPKKEINRVLYSLAKKGKLQKEAGTPPLWKIAVSTQAWNQHSGVVRPDGHSQGAPNSDPSLEPEDRNSTSVSEDLLEPFIAVSAQAWNQHSGVVRPDSHSQGSPNSDPGLEPEDSNSTSALEDPLEFLDMAEIKEKICDYLFNVSDSSALNLAKNIGLTKARDINAVLIDMERQGDVYRQGTTPPIWHLTDKKRERMQIKRNTNSVPETAPAAIPETKRNAEFLTCNIPTSNASNNMVTTEKVENGQEPVIKLENRQEARPEPARLKPPVHYNGPSKAGYVDFENGQWATDDIPDDLNSIRAAPGEFRAIMEMPSFYSHGLPRCSPYKKLTECQLKNPISGLLEYAQFASQTCEFNMIEQSGPPHEPRFKFQVVINGREFPPAEAGSKKVAKQDAAMKAMTILLEEAKAKDSGKSEESSHYSTEKESEKTAESQTPTPSATSFFSGKSPVTTLLECMHKLGNSCEFRLLSKEGPAHEPKFQYCVAVGAQTFPSVSAPSKKVAKQMAAEEAMKALHGEATNSMASDNQPEGMISESLDNLESMMPNKVRKIGELVRYLNTNPVGGLLEYARSHGFAAEFKLVDQSGPPHEPKFVYQAKVGGRWFPAVCAHSKKQGKQEAADAALRVLIGENEKAERMGFTEVTPVTGASLRRTMLLLSRSPEAQPKTLPLTGSTFHDQIAMLSHRCFNTLTNSFQPSLLGRKILAAIIMKKDSEDMGVVVSLGTGNRCVKGDSLSLKGETVNDCHAEIISRRGFIRFLYSELMKYNSQTAKDSIFEPAKGGEKLQIKKTVSFHLYISTAPCGDGALFDKSCSDRAMESTESRHYPVFENPKQGKLRTKVENGEGTIPVESSDIVPTWDGIRLGERLRTMSCSDKILRWNVLGLQGALLTHFLQPIYLKSVTLGYLFSQGHLTRAICCRVTRDGSAFEDGLRHPFIVNHPKVGRVSIYDSKRQSGKTKETSVNWCLADGYDLEILDGTRGTVDGPRNELSRVSKKNIFLLFKKLCSFRYRRDLLRLSYGEAKKAARDYETAKNYFKKGLKDMGYGNWISKPQEEKNFYLCPV","Homo sapiens","string:","2acj,3f21,2mdr,1xmk,1qgp","Tbio","Enzyme","2.272553","3.59158","2.440579","2.76763","3.363754","1.62941","3.079426","4.108275","4.692083","4.75634","4.167583","2.841188","4.965374","2.526078","2.40247","3.443878","3.097392","2.800249","2.517834","1.645422"
"stringdb:9606.ENSP00000358548","2.589269","4.78724","4.421491","2.010027","4.49155","4.423434","1.968468","2.368679","3.614063","1.29868","4.114562","NRAS","9606.ENSP00000358548","NRAS","false","9606.ENSP00000358548","P01111","9606.ENSP00000358548","GTPase NRas; Ras proteins bind GDP/GTP and possess intrinsic GTPase activity.","label: attribute=""display name"" labelsize=12 labelAlignment=left outline=true outlineColor=white outlineTransparency=95 outlineWidth=10 background=false color=black dropShadow=false",,"https://version-12-0.string-db.org/images/Proteinpictures/pdb/6z/6zio_A.png","stringdb","protein","MTEYKLVVVGAGGVGKSALTIQLIQNHFVDEYDPTIEDSYRKQVVIDGETCLLDILDTAGQEEYSAMRDQYMRTGEGFLCVFAINNSKSFADINLYREQIKRVKDSDDVPMVLVGNKCDLPTRTVDTKQAHELAKSYGIPFIETSAKTRQGVEDAFYTLVREIRQYRMKKLNSSDDGTQGCMGLPCVVM","Homo sapiens","string:","6zio","Tchem","Enzyme","2.39605","3.319415","2.07527","4.681181","2.235666","2.296596","2.873439","3.784641","4.676923","3.626789","3.508978","2.786704","4.782458","2.64836","2.318016","3.75203","3.046439","2.885784","3.177105","2.244067"
"stringdb:9606.ENSP00000376436","2.251242","3.593048","1.663278","1.432536","2.308366","1.320072","1.553126","2.025399","4.888296","1.391744","2.349965","ETS1","9606.ENSP00000376436","ETS1","false","9606.ENSP00000376436","P14921","9606.ENSP00000376436","Protein C-ets-1; Transcription factor. Directly controls the expression of cytokine and chemokine genes in a wide variety of different cellular contexts. May control the differentiation, survival and proliferation of lymphoid cells. May also regulate angiogenesis through regulation of expression of genes controlling endothelial cell migration and invasion; Belongs to the ETS family.","label: attribute=""display name"" labelsize=12 labelAlignment=left outline=true outlineColor=white outlineTransparency=95 outlineWidth=10 background=false color=black dropShadow=false",,"https://version-12-0.string-db.org/images/Proteinpictures/pdb/3w/3wtt_H.png","stringdb","protein","MSYFVDSAGSSPVPYSAPRPAVVRQGPSNTYEDPRMNCGFQSNYHQQRPCYPFWDEMATQEVPTGLEHCVSDMECADVPLLTPSSKEMMSQALKATFSGFTKEQQRLGIPKDPRQWTETHVRDWVMWAVNEFSLKGVDFQKFCMNGAALCALGKDCFLELAPDFVGDILWEHLEILQKEDVKPYQVNGVNPAYPESRYTSDYFISYGIEHAQCVPPSEFSEPSFITESYQTLHPISSEELLSLKYENDYPSVILRDPLQTDTLQNDYFAIKQEVVTPDNMCMGRTSRGKLGGQDSFESIESYDSCDRLTQSWSSQSSFNSLQRVPSYDSFDSEDYPAALPNHKPKGTFKDYVRDRADLNKDKPVIPAAALAGYTGSGPIQLWQFLLELLTDKSCQSFISWTGDGWEFKLSDPDEVARRWGKRKNKPKMNYEKLSRGLRYYYDKNIIHKTAGKRYVYRFVCDLQSLLGYTPEELHAMLDVKPDADE","Homo sapiens","string:","2stw,2jv3,3wtt,1k78","Tbio","Transcription Factor","2.128219","3.055428","2.039221","2.916159","1.668245","2.027366","3.254227","3.298831","3.018616","3.001338","4.671497","2.999012","2.801718","2.329048","1.94669","2.805474","3.457037","2.604925","2.678296","2.170536"
"stringdb:9606.ENSP00000244050","3.561314","4.777047","2.103977","1.881919","2.750944","1.616537","2.073292","2.449334","5.0","1.525461","2.881277","SNAI1","9606.ENSP00000244050","SNAI1","false","9606.ENSP00000244050","O95863","9606.ENSP00000244050","Zinc finger protein SNAI1; Involved in induction of the epithelial to mesenchymal transition (EMT), formation and maintenance of embryonic mesoderm, growth arrest, survival and cell migration. Binds to 3 E-boxes of the E-cadherin/CDH1 gene promoter and to the promoters of CLDN7 and KRT8 and, in association with histone demethylase KDM1A which it recruits to the promoters, causes a decrease in dimethylated H3K4 levels and represses transcription . The N- terminal SNAG domain competes with histone H3 for the same binding site on the histone demethylase complex formed by KDM1A and RCOR1, and thereby inhibits demethylation of histone H3 at 'Lys-4' (in vitro) . During EMT, involved with LOXL2 in negatively regulating pericentromeric heterochromatin transcription (By similarity). SNAI1 recruits LOXL2 to pericentromeric regions to oxidize histone H3 and repress transcription which leads to release of heterochromatin component CBX5/HP1A, enabling chromatin reorganization and acquisition of mesenchymal traits (By similarity). Associates with EGR1 and SP1 to mediate tetradecanoyl phorbol acetate (TPA)-induced up-regulation of CDKN2B, possibly by binding to the CDKN2B promoter region 5'-TCACA-3. In addition, may also activate the CDKN2B promoter by itself. ECO:0000269|PubMed:10655587, ECO:0000269|PubMed:15647282, ECO:0000269|PubMed:16096638, ECO:0000269|PubMed:20121949, ECO:0000269|PubMed:20389281, ECO:0000269|PubMed:20562920, ECO:0000269|PubMed:21300290, ECO:0000269|PubMed:21952048,; Belongs to the snail C2H2-type zinc-finger protein family. ","label: attribute=""display name"" labelsize=12 labelAlignment=left outline=true outlineColor=white outlineTransparency=95 outlineWidth=10 background=false color=black dropShadow=false",,"https://version-12-0.string-db.org/images/Proteinpictures/pdb/3w/3w5k_B.png","stringdb","protein","MPRSFLVRKPSDPNRKPNYSELQDSNPEFTFQQPYDQAHLLAAIPPPEILNPTASLPMLIWDSVLAPQAQPIAWASLRLQESPRVAELTSLSDEDSGKGSQPPSPPSPAPSSFSSTSVSSLEAEAYAAFPGLGQVPKQLAQLSEAKDLQARKAFNCKYCNKEYLSLGALKMHIRSHTLPCVCGTCGKAFSRPWLLQGHVRTHTGEKPFSCPHCSRAFADRSNLRAHLQTHSDVKKYQCQACARTFSRMSLLHKHQESGCSGCPR","Homo sapiens","string:","3w5k","Tbio","Transcription Factor","2.389791","2.858176","2.384133","2.927296","2.201665","2.253395","3.02209","3.400691","3.294953","3.018178","3.520861","3.259303","3.176869","3.121186","2.389111","3.21282","2.817465","3.02057","2.784013","2.16267"
"stringdb:9606.ENSP00000493712","4.493131","4.788136","1.769548","1.269927","2.384104","1.81674","1.408289","5.0","5.0","1.074795","2.197484","RAD51","9606.ENSP00000493712","RAD51","false","9606.ENSP00000493712","Q06609","9606.ENSP00000493712","DNA repair protein RAD51 homolog 1; Plays an important role in homologous strand exchange, a key step in DNA repair through homologous recombination (HR) . Binds to single and double-stranded DNA and exhibits DNA-dependent ATPase activity. Catalyzes the recognition of homology and strand exchange between homologous DNA partners to form a joint molecule between a processed DNA break and the repair template. Binds to single-stranded DNA in an ATP-dependent manner to form nucleoprotein filaments which are essential for the homology search and strand exchange . Part of a PALB2-scaffolded HR complex containing BRCA2 and RAD51C and which is thought to play a role in DNA repair by HR. Plays a role in regulating mitochondrial DNA copy number under conditions of oxidative stress in the presence of RAD51C and XRCC3. Also involved in interstrand cross-link repair . ECO:0000269|PubMed:12442171, ECO:0000269|PubMed:18417535, ECO:0000269|PubMed:20231364, ECO:0000269|PubMed:20348101, ECO:0000269|PubMed:20413593, ECO:0000269|PubMed:23509288, ECO:0000269|PubMed:23754376, ECO:0000269|PubMed:26253028,; Belongs to the RecA family. RAD51 subfamily.","label: attribute=""display name"" labelsize=12 labelAlignment=left outline=true outlineColor=white outlineTransparency=95 outlineWidth=10 background=false color=black dropShadow=false",,"https://version-12-0.string-db.org/images/Proteinpictures/pdb/5n/5nwl_A.png","stringdb","protein","MAMQMQLEANADTSVEEESFGPQPISRLEQCGINANDVKKLEEAGFHTVEAVAYAPKKELINIKGISEAKADKILTESRSVARLECNSVILVYCTLRLSGSSDSPASASRVVGTTGGIETGSITEMFGEFRTGKTQICHTLAVTCQLPIDRGGGEGKAMYIDTEGTFRPERLLAVAERYGLSGSDVLDNVAYARAFNTDHQTQLLYQASAMMVESRYALLIVDSATALYRTDYSGRGELSARQMHLARFLRMLLRLADEFGVAVVITNQVVAQVDGAAMFAADPKKPIGGNIIAHASTTRLYLRKGRGETRICKIYDSPCLPEAEAMFAINADGVGDAKD","Homo sapiens","string:","5nwl,1b22,1n0w","Tchem","Other","1.383785","2.854626","2.300617","2.449037","1.42592","1.362928","2.337508","3.086148","2.35849","2.453423","2.984659","2.24106","4.587609","2.205899","1.385589","2.186655","1.91692","2.360039","2.389472","1.690594"
"stringdb:9606.ENSP00000357055","5.0","4.783685","1.195894","1.068315","1.39324","0.686319","1.281169","1.687122","4.567672",,"1.766133","PEA15","9606.ENSP00000357055","PEA15","false","9606.ENSP00000357055","Q15121","9606.ENSP00000357055","Astrocytic phosphoprotein PEA-15; Blocks Ras-mediated inhibition of integrin activation and modulates the ERK MAP kinase cascade. Inhibits RPS6KA3 activities by retaining it in the cytoplasm (By similarity). Inhibits both TNFRSF6- and TNFRSF1A-mediated CASP8 activity and apoptosis. Regulates glucose transport by controlling both the content of SLC2A1 glucose transporters on the plasma membrane and the insulin-dependent trafficking of SLC2A4 from the cell interior to the surface. ","label: attribute=""display name"" labelsize=12 labelAlignment=left outline=true outlineColor=white outlineTransparency=95 outlineWidth=10 background=false color=black dropShadow=false",,"https://version-12-0.string-db.org/images/Proteinpictures/pdb/4i/4iz5_H.png","stringdb","protein","MEDEGNKLCQAPPWPGQTSPVMAEYGTLLQDLTNNITLEDLEQLKSACKEDIPSEKSEEITTGSAWFSFLESHNKLDKDNLSYIEHIFEISRRPDLLTMVVDYRTRVLKISEEDELDTKLTRIPSAKKYKDIIRQPSEEEIIKLAPPPKKA","Homo sapiens","string:","4iz7,4iz5","Tbio","Other","2.432408","3.831376","3.286879","1.559081","4.446214","1.995928","4.763902","4.214365","3.974286","4.869991","4.705674","2.977916","4.993892","4.578939","1.470312","4.907248","2.547588","2.284179","2.383333","2.045323"
"stringdb:9606.ENSP00000379287","2.469433","4.761054","1.949326","1.676479","4.450585","1.532369","1.722689","2.495904","4.647604","1.254213","2.287011","YWHAZ","9606.ENSP00000379287","YWHAZ","false","9606.ENSP00000379287","Q6NUR9","9606.ENSP00000379287","14-3-3 protein zeta/delta; Adapter protein implicated in the regulation of a large spectrum of both general and specialized signaling pathways. Binds to a large number of partners, usually by recognition of a phosphoserine or phosphothreonine motif. Binding generally results in the modulation of the activity of the binding partner. Induces ARHGEF7 activity on RAC1 as well as lamellipodia and membrane ruffle formation . In neurons, regulates spine maturation through the modulation of ARHGEF7 activity (By similarity).  ECO:0000269|PubMed:15071501, ECO:0000269|PubMed:15644438, ECO:0000269|PubMed:16376338, ECO:0000269|PubMed:16959763,; Belongs to the 14-3-3 family.","label: attribute=""display name"" labelsize=12 labelAlignment=left outline=true outlineColor=white outlineTransparency=95 outlineWidth=10 background=false color=black dropShadow=false",,"https://version-12-0.string-db.org/images/Proteinpictures/pdb/6f/6f09_P.png","stringdb","protein","MDKNELVQKAKLAEQAERYDDMAACMKSVTEQGAELSNEERNLLSVAYKNVVGARRSSWRVVSSIEQKTEGAEKKQQMAREYREKIETELRDICNDVLSLLEKFLIPNASQAESKVFYLKMKGDYYRYLAEVAAGDDKKGIVDQSQQAYQEAFEISKKEMQPTHPIRLGLALNFSVFYYEILNSPEKACSLAKTAFDEAIAELDTLSEESYKDSTLIMQLLRDNLTLWTSDTQGDEAEAGEGGEN","Homo sapiens","string:","6f09","Tchem","Other","2.85639","4.767288","2.287923","4.631999","4.825478","2.149014","3.614551","4.887926","3.525879","4.739087","4.000589","3.144579","4.985215","3.367316","2.474544","4.845392","3.287533","3.084234","2.979277","2.642479"
"stringdb:9606.ENSP00000457421","3.43554","2.701049","2.246726","2.183044","4.646885","1.791775","2.267342","2.631016","3.378934","1.653012","5.0","PECAM1","9606.ENSP00000457421","PECAM1","false","9606.ENSP00000457421","Q9NPB7","9606.ENSP00000457421","Platelet endothelial cell adhesion molecule; Cell adhesion molecule which is required for leukocyte transendothelial migration (TEM) under most inflammatory conditions . Tyr-690 plays a critical role in TEM and is required for efficient trafficking of PECAM1 to and from the lateral border recycling compartment (LBRC) and is also essential for the LBRC membrane to be targeted around migrating leukocytes . Trans-homophilic interaction may play a role in endothelial cell-cell adhesion via cell junctions . Heterophilic interaction with CD177 plays a role in transendothelial migration of neutrophils . Homophilic ligation of PECAM1 prevents macrophage-mediated phagocytosis of neighboring viable leukocytes by transmitting a detachment signal . Promotes macrophage-mediated phagocytosis of apoptotic leukocytes by tethering them to the phagocytic cells; PECAM1-mediated detachment signal appears to be disabled in apoptotic leukocytes . Modulates bradykinin receptor BDKRB2 activation . Regulates bradykinin- and hyperosmotic shock-induced ERK1/2 activation in endothelial cells . Induces susceptibility to atherosclerosis (By similarity).  ECO:0000269|PubMed:17580308, ECO:0000269|PubMed:18672896,","label: attribute=""display name"" labelsize=12 labelAlignment=left outline=true outlineColor=white outlineTransparency=95 outlineWidth=10 background=false color=black dropShadow=false",,"https://version-12-0.string-db.org/images/Proteinpictures/pdb/5c/5c14_A.png","stringdb","protein","MQPRWAQGATMWLGVLLTLLLCSSLEGQENSFTINSVDMKSLPDWTVQNGKNLTLQCFADVSTTSHVKPQHQMLFYKDDVLFYNISSMKSTESYFIPEVRIYDSGTYKCTVIVNNKEKTTAEYQVLVEGVPSPRVTLDKKEAIQGGIVRVNCSVPEEKAPIHFTIEKLELNEKMVKLKREKNSRDQNFVILEFPVEEQDRVLSFRCQARIISGIHMQTSESTKSELVTVTESFSTPKFHISPTGMIMEGAQLHIKCTIQVTHLAQEFPEIIIQKDKAIVAHNRHGNKAVYSVMAMVEHSGNYTCKVESSRISKVSSIVVNITELFSKPELESSFTHLDQGERLNLSCSIPGAPPANFTIQKEDTIVSQTQDFTKIASKSDSGTYICTAGIDKVVKKSNTVQIVVCEMLSQPRISYDAQFEVIKGQTIEVRCESISGTLPISYQLLKTSKVLENSTKNSNDPAVFKDNPTEDVEYQCVADNCHSHAKMLSEVLRVKVIAPVDEVQISILSSKVVESGEDIVLQCAVNEGSGPITYKFYREKEGKPFYQMTSNATQAFWTKQKASKEQEGEYYCTAFNRANHASSVPRSKILTVRVILAPWKKGLIAVVIIGVIIALLIIAAKCYFLRKAKAKQMPVEMSRPAVPLLNSNNEKMSDPNMEANSHYGHNDDVRNHAMKPINDNKEPLNSDVQYTEVQVSSAESHKDLGKKDTETVYSEVRKAVPDAVESRYSRTEGSLDGT","Homo sapiens","string:","2ky5,5c14","Tbio","Other","1.943784","4.715915","3.06722","3.199479","2.833044","1.577138","4.097866","2.816116","2.967822","4.60668","4.628879","3.473842","4.617749","2.546125","1.998584","2.993517","2.917164","2.221267","2.11451","2.126325"
"stringdb:9606.ENSP00000301178","4.695305","2.331138","1.988303","2.176231","5.0","1.854847","2.388939","2.555188","2.864517","1.385516","4.791864","AXL","9606.ENSP00000301178","AXL","false","9606.ENSP00000301178","P30530","9606.ENSP00000301178","Tyrosine-protein kinase receptor UFO; Receptor tyrosine kinase that transduces signals from the extracellular matrix into the cytoplasm by binding growth factor GAS6 and which is thus regulating many physiological processes including cell survival, cell proliferation, migration and differentiation. Ligand binding at the cell surface induces dimerization and autophosphorylation of AXL. Following activation by ligand, ALX binds and induces tyrosine phosphorylation of PI3-kinase subunits PIK3R1, PIK3R2 and PIK3R3; but also GRB2, PLCG1, LCK and PTPN11. Other downstream substrate candidates for AXL are CBL, NCK2, SOCS1 and TNS2. Recruitment of GRB2 and phosphatidylinositol 3 kinase regulatory subunits by AXL leads to the downstream activation of the AKT kinase. GAS6/AXL signaling plays a role in various processes such as endothelial cell survival during acidification by preventing apoptosis, optimal cytokine signaling during human natural killer cell development, hepatic regeneration, gonadotropin-releasing hormone neuron survival and migration, platelet activation, or regulation of thrombotic responses. Plays also an important role in inhibition of Toll-like receptors (TLRs)-mediated innate immune response.  ECO:0000269|PubMed:12364394, ECO:0000269|PubMed:12490074, ECO:0000269|PubMed:15507525, ECO:0000269|PubMed:15733062, (Microbial infection) Acts as a receptor for Ebolavirus, possibly through GAS6 binding to phosphatidyl-serine at the surface of virion envelope.","label: attribute=""display name"" labelsize=12 labelAlignment=left outline=true outlineColor=white outlineTransparency=95 outlineWidth=10 background=false color=black dropShadow=false",,"https://version-12-0.string-db.org/images/Proteinpictures/pdb/5u/5u6b_B.png","stringdb","protein","MAWRCPRMGRVPLAWCLALCGWACMAPRGTQAEESPFVGNPGNITGARGLTGTLRCQLQVQGEPPEVHWLRDGQILELADSTQTQVPLGEDEQDDWIVVSQLRITSLQLSDTGQYQCLVFLGHQTFVSQPGYVGLEGLPYFLEEPEDRTVAANTPFNLSCQAQGPPEPVDLLWLQDAVPLATAPGHGPQRSLHVPGLNKTSSFSCEAHNAKGVTTSRTATITVLPQQPRNLHLVSRQPTELEVAWTPGLSGIYPLTHCTLQAVLSDDGMGIQAGEPDPPEEPLTSQASVPPHQLRLGSLHPHTPYHIRVACTSSQGPSSWTHWLPVETPEGVPLGPPENISATRNGSQAFVHWQEPRAPLQGTLLGYRLAYQGQDTPEVLMDIGLRQEVTLELQGDGSVSNLTVCVAAYTAAGDGPWSLPVPLEAWRPGQAQPVHQLVKEPSTPAFSWPWWYVLLGAVVAAACVLILALFLVHRRKKETRYGEVFEPTVERGELVVRYRVRKSYSRRTTEATLNSLGISEELKEKLRDVMVDRHKVALGKTLGEGEFGAVMEGQLNQDDSILKVAVKTMKIAICTRSELEDFLSEAVCMKEFDHPNVMRLIGVCFQGSERESFPAPVVILPFMKHGDLHSFLLYSRLGDQPVYLPTQMLVKFMADIASGMEYLSTKRFIHRDLAARNCMLNENMSVCVADFGLSKKIYNGDYYRQGRIAKMPVKWIAIESLADRVYTSKSDVWSFGVTMWEIATRGQTPYPGVENSEIYDYLRQGNRLKQPADCLDGLYALMSRCWELNPQDRPSFTELREDLENTLKALPPAQEPDEILYVNMDEGGGYPEPPGAAGGADPPTQPDPKDSCSCLTAAEVHPAGRYVLCPSTTPSPAQPADRGSPAAPGQEDGA","Homo sapiens","string:","5vxz,2c5d,5u6b","Tchem","Kinase","2.193951","2.814646","2.774441","2.357827","2.72301","1.958746","3.14443","2.972269","2.893227","2.851108","3.200347","2.794805","4.122616","2.25592","1.662755","3.083171","3.165946","2.197953","2.229121","1.69536"
