"stringdb:9606.ENSP00000275493","3.393466","4.130517","4.135183","5.0","5.0","4.058895","3.18225","3.044866","5.0","2.332025","4.944711","EGFR","9606.ENSP00000275493","EGFR","false","9606.ENSP00000275493","Q9H2C9","9606.ENSP00000275493","Epidermal growth factor receptor; Receptor tyrosine kinase binding ligands of the EGF family and activating several signaling cascades to convert extracellular cues into appropriate cellular responses (PubMed:2790960, PubMed:10805725, PubMed:27153536). Known ligands include EGF, TGFA/TGF-alpha, AREG, epigen/EPGN, BTC/betacellulin, epiregulin/EREG and HBEGF/heparin- binding EGF (PubMed:2790960, PubMed:7679104, PubMed:8144591, PubMed:9419975, PubMed:15611079, PubMed:12297049, PubMed:27153536, PubMed:20837704). Ligand binding triggers receptor homo- and/or heterodimerization and autophosphorylation on key cytoplasmic residues. The phosphorylated receptor recruits adapter proteins like GRB2 which in turn activates complex downstream signaling cascades. Activates at least 4 major downstream signaling cascades including the RAS-RAF-MEK- ERK, PI3 kinase-AKT, PLCgamma-PKC and STATs modules . May also activate the NF-kappa-B signaling cascade . Also directly phosphorylates other proteins like RGS16, activating its GTPase activity and probably coupling the EGF receptor signaling to the G protein-coupled receptor signaling . Also phosphorylates MUC1 and increases its interaction with SRC and CTNNB1/beta-catenin . Positively regulates cell migration via interaction with CCDC88A/GIV which retains EGFR at the cell membrane following ligand stimulation, promoting EGFR signaling which triggers cell migration . Plays a role in enhancing learning and memory performance (By similarity).  ECO:0000269|PubMed:11116146, ECO:0000269|PubMed:11483589, ECO:0000269|PubMed:11602604, ECO:0000269|PubMed:12297049, ECO:0000269|PubMed:12297050, ECO:0000269|PubMed:12620237, ECO:0000269|PubMed:12873986, ECO:0000269|PubMed:15374980, ECO:0000269|PubMed:15590694, ECO:0000269|PubMed:15611079, ECO:0000269|PubMed:17115032, ECO:0000269|PubMed:19560417, ECO:0000269|PubMed:20462955, ECO:0000269|PubMed:20837704, ECO:0000269|PubMed:21258366, ECO:0000269|PubMed:27153536, ECO:0000269|PubMed:2790960, ECO:0000269|PubMed:7679104, (Microbial infection) Acts as a receptor for hepatitis C virus (HCV) in hepatocytes and facilitates its cell entry. Mediates HCV entry by promoting the formation of the CD81-CLDN1 receptor complexes that are essential for HCV entry and by enhancing membrane fusion of cells expressing HCV envelope glycoproteins. ","label: attribute=""display name"" labelsize=12 labelAlignment=left outline=true outlineColor=white outlineTransparency=95 outlineWidth=10 background=false color=black dropShadow=false",,"https://version-12-0.string-db.org/images/Proteinpictures/pdb/7s/7syd_A.png","stringdb","protein","MRPSGTAGAALLALLAALCPASRALEEKKVCQGTSNKLTQLGTFEDHFLSLQRMFNNCEVVLGNLEITYVQRNYDLSFLKTIQEVAGYVLIALNTVERIPLENLQIIRGNMYYENSYALAVLSNYDANKTGLKELPMRNLQEILHGAVRFSNNPALCNVESIQWRDIVSSDFLSNMSMDFQNHLGSCQKCDPSCPNGSCWGAGEENCQKLTKIICAQQCSGRCRGKSPSDCCHNQCAAGCTGPRESDCLVCRKFRDEATCKDTCPPLMLYNPTTYQMDVNPEGKYSFGATCVKKCPRNYVVTDHGSCVRACGADSYEMEEDGVRKCKKCEGPCRKVCNGIGIGEFKDSLSINATNIKHFKNCTSISGDLHILPVAFRGDSFTHTPPLDPQELDILKTVKEITGFLLIQAWPENRTDLHAFENLEIIRGRTKQHGQFSLAVVSLNITSLGLRSLKEISDGDVIISGNKNLCYANTINWKKLFGTSGQKTKIISNRGENSCKATGQVCHALCSPEGCWGPEPRDCVSCRNVSRGRECVDKCNLLEGEPREFVENSECIQCHPECLPQAMNITCTGRGPDNCIQCAHYIDGPHCVKTCPAGVMGENNTLVWKYADAGHVCHLCHPNCTYGCTGPGLEGCPTNGPKIPSIATGMVGALLLLLVVALGIGLFMRRRHIVRKRTLRRLLQERELVEPLTPSGEAPNQALLRILKETEFKKIKVLGSGAFGTVYKGLWIPEGEKVKIPVAIKELREATSPKANKEILDEAYVMASVDNPHVCRLLGICLTSTVQLITQLMPFGCLLDYVREHKDNIGSQYLLNWCVQIAKGMNYLEDRRLVHRDLAARNVLVKTPQHVKITDFGLAKLLGAEEKEYHAEGGKVPIKWMALESILHRIYTHQSDVWSYGVTVWELMTFGSKPYDGIPASEISSILEKGERLPQPPICTIDVYMIMVKCWMIDADSRPKFRELIIEFSKMARDPQRYLVIQGDERMHLPSPTDSNFYRALMDEEDMDDVVDADEYLIPQQGFFSSPSTSRTPLLSSLSATSNNSTVACIDRNGLQSCPIKEDSFLQRYSSDPTGALTEDSIDDTFLPVPEYINQSVPKRPAGSVQNPVYHNQPLNPAPSRDPHYQDPHSTAVGNPEYLNTVQPTCVNSTFDSPAHWAQKGSHQISLDNPDYQQDFFPKEAKPNGIFKGSTAENAEYLRVAPQSSEFIGA","Homo sapiens","string:","6v6o,5wb7,3buo,3b2u,4krp,3g5y,7syd,5lv6,3lzb,1z9i,2m20,2n5s","Tclin","Kinase","2.945779","3.606703","2.683236","2.863087","3.285872","2.665931","3.486708","3.877404","3.574899","4.779539","3.97717","3.408794","4.489406","3.285759","3.058202","3.689377","3.350035","3.217738","3.279068","2.617298"
"stringdb:9606.ENSP00000355759","3.061145","5.0","2.619667","1.927998","2.693404","1.845138","2.530164","5.0","5.0","1.889013","2.79802","PARP1","9606.ENSP00000355759","PARP1","false","9606.ENSP00000355759","P09874","9606.ENSP00000355759","Poly [ADP-ribose] polymerase 1; Poly-ADP-ribosyltransferase that mediates poly-ADP- ribosylation of proteins and plays a key role in DNA repair (PubMed:17177976, PubMed:18172500, PubMed:19344625, PubMed:19661379, PubMed:23230272, PubMed:25043379, PubMed:26344098). Mainly mediates glutamate and aspartate ADP-ribosylation of target proteins: the ADP-D- ribosyl group of NAD(+) is transferred to the acceptor carboxyl group of glutamate and aspartate residues and further ADP-ribosyl groups are transferred to the 2'-position of the terminal adenosine moiety, building up a polymer with an average chain length of 20-30 units . Mediates the poly(ADP-ribosyl)ation of a number of proteins, including itself, APLF and CHFR . Also mediates serine ADP-ribosylation of target proteins following interaction with HPF1; HPF1 conferring serine specificity . Probably also catalyzes tyrosine ADP-ribosylation of target proteins following interaction with HPF1 . Catalyzes the poly-ADP- ribosylation of histones in a HPF1-dependent manner . Involved in the base excision repair (BER) pathway by catalyzing the poly-ADP-ribosylation of a limited number of acceptor proteins involved in chromatin architecture and in DNA metabolism (PubMed:17177976, PubMed:18172500, PubMed:19344625, PubMed:19661379, PubMed:23230272). ADP-ribosylation follows DNA damage and appears as an obligatory step in a detection/signaling pathway leading to the reparation of DNA strand breaks (PubMed:17177976, PubMed:18172500, PubMed:19344625, PubMed:19661379, PubMed:23230272). In addition to base excision repair (BER) pathway, also involved in double-strand breaks (DSBs) repair: together with TIMELESS, accumulates at DNA damage sites and promotes homologous recombination repair by mediating poly-ADP-ribosylation . In addition to proteins, also able to ADP-ribosylate DNA: catalyzes ADP-ribosylation of DNA strand break termini containing terminal phosphates and a 2'-OH group in single- and double-stranded DNA, respectively . Required for PARP9 and DTX3L recruitment to DNA damage sites . PARP1- dependent PARP9-DTX3L-mediated ubiquitination promotes the rapid and specific recruitment of 53BP1/TP53BP1, UIMC1/RAP80, and BRCA1 to DNA damage sites . Acts as a regulator of transcription: positively regulates the transcription of MTUS1 and negatively regulates the transcription of MTUS2/TIP150 . With EEF1A1 and TXK, forms a complex that acts as a T-helper 1 (Th1) cell- specific transcription factor and binds the promoter of IFN-gamma to directly regulate its transcription, and is thus involved importantly in Th1 cytokine production . Involved in the synthesis of ATP in the nucleus, together with NMNAT1, PARG and NUDT5 . Nuclear ATP generation is required for extensive chromatin remodeling events that are energy-consuming . ECO:0000269|PubMed:17396150, ECO:0000269|PubMed:18172500, ECO:0000269|PubMed:19344625, ECO:0000269|PubMed:19661379, ECO:0000269|PubMed:19764761, ECO:0000269|PubMed:23230272, ECO:0000269|PubMed:25043379, ECO:0000269|PubMed:26344098, ECO:0000269|PubMed:27067600, ECO:0000269|PubMed:27257257, ECO:0000269|PubMed:27471034, ECO:0000269|PubMed:28190768, ECO:0000269|PubMed:30257210, ECO:0000269|PubMed:30356214,","label: attribute=""display name"" labelsize=12 labelAlignment=left outline=true outlineColor=white outlineTransparency=95 outlineWidth=10 background=false color=black dropShadow=false",,"https://version-12-0.string-db.org/images/Proteinpictures/pdb/4d/4dqy_C.png","stringdb","protein","MAESSDKLYRVEYAKSGRASCKKCSESIPKDSLRMAIMVQSPMFDGKVPHWYHFSCFWKVGHSIRHPDVEVDGFSELRWDDQQKVKKTAEAGGVTGKGQDGIGSKAEKTLGDFAAEYAKSNRSTCKGCMEKIEKGQVRLSKKMVDPEKPQLGMIDRWYHPGCFVKNREELGFRPEYSASQLKGFSLLATEDKEALKKQLPGVKSEGKRKGDEVDGVDEVAKKKSKKEKDKDSKLEKALKAQNDLIWNIKDELKKVCSTNDLKELLIFNKQQVPSGESAILDRVADGMVFGALLPCEECSGQLVFKSDAYYCTGDVTAWTKCMVKTQTPNRKEWVTPKEFREISYLKKLKVKKQDRIFPPETSASVAATPPPSTASAPAAVNSSASADKPLSNMKILTLGKLSRNKDEVKAMIEKLGGKLTGTANKASLCISTKKEVEKMNKKMEEVKEANIRVVSEDFLQDVSASTKSLQELFLAHILSPWGAEVKAEPVEVVAPRGKSGAALSKKSKGQVKEEGINKSEKRMKLTLKGGAAVDPDSGLEHSAHVLEKGGKVFSATLGLVDIVKGTNSYYKLQLLEDDKENRYWIFRSWGRVGTVIGSNKLEQMPSKEDAIEHFMKLYEEKTGNAWHSKNFTKYPKKFYPLEIDYGQDEEAVKKLTVNPGTKSKLPKPVQDLIKMIFDVESMKKAMVEYEIDLQKMPLGKLSKRQIQAAYSILSEVQQAVSQGSSDSQILDLSNRFYTLIPHDFGMKKPPLLNNADSVQAKVEMLDNLLDIEVAYSLLRGGSDDSSKDPIDVNYEKLKTDIKVVDRDSEEAEIIRKYVKNTHATTHNAYDLEVIDIFKIEREGECQRYKPFKQLHNRRLLWHGSRTTNFAGILSQGLRIAPPEAPVTGYMFGKGIYFADMVSKSANYCHTSQGDPIGLILLGEVALGNMYELKHASHISKLPKGKHSVKGLGKTTPDPSANISLDGVDVPLGTGISSGVNDTSLLYNEYIVYDIAQVNLKYLLKLKFNFKTSLW","Homo sapiens","string:","2l31,2n8a,7s81,7s81,7s81,6bhv,4dqy,2cr9,7kk5,7scz,2jvn,2l30","Tclin","Enzyme","3.224099","3.966961","2.570544","3.108507","3.900779","2.306569","3.547742","4.262993","3.502261","4.73915","4.222274","3.255397","4.98009","3.950688","2.395173","4.03282","3.318021","3.043583","2.824177","2.525611"
"stringdb:9606.ENSP00000374455","2.812682","4.744633","4.162787","4.077562","4.478282","2.160598","4.700322","3.929631","5.0","2.54516","2.477026","SQSTM1","9606.ENSP00000374455","SQSTM1","false","9606.ENSP00000374455","Q13501","9606.ENSP00000374455","Sequestosome-1; Autophagy receptor required for selective macroautophagy (aggrephagy). Functions as a bridge between polyubiquitinated cargo and autophagosomes. Interacts directly with both the cargo to become degraded and an autophagy modifier of the MAP1 LC3 family (PubMed:16286508, PubMed:20168092, PubMed:24128730, PubMed:28404643, PubMed:22622177). Along with WDFY3, involved in the formation and autophagic degradation of cytoplasmic ubiquitin-containing inclusions (p62 bodies, ALIS/aggresome-like induced structures). Along with WDFY3, required to recruit ubiquitinated proteins to PML bodies in the nucleus . May regulate the activation of NFKB1 by TNF-alpha, nerve growth factor (NGF) and interleukin-1. May play a role in titin/TTN downstream signaling in muscle cells. May regulate signaling cascades through ubiquitination. Adapter that mediates the interaction between TRAF6 and CYLD (By similarity). May be involved in cell differentiation, apoptosis, immune response and regulation of K(+) channels. Involved in endosome organization by retaining vesicles in the perinuclear cloud: following ubiquitination by RNF26, attracts specific vesicle-associated adapters, forming a molecular bridge that restrains cognate vesicles in the perinuclear region and organizes the endosomal pathway for efficient cargo transport . Promotes relocalization of 'Lys-63'-linked ubiquitinated STING1 to autophagosomes . Acts as an activator of the NFE2L2/NRF2 pathway via interaction with KEAP1: interaction inactivates the BCR(KEAP1) complex, promoting nuclear accumulation of NFE2L2/NRF2 and subsequent expression of cytoprotective genes .  ECO:0000269|PubMed:10356400, ECO:0000269|PubMed:10747026, ECO:0000269|PubMed:11244088, ECO:0000269|PubMed:12471037, ECO:0000269|PubMed:15340068, ECO:0000269|PubMed:15802564, ECO:0000269|PubMed:15911346, ECO:0000269|PubMed:15953362, ECO:0000269|PubMed:16079148, ECO:0000269|PubMed:16286508, ECO:0000269|PubMed:19931284, ECO:0000269|PubMed:20168092, ECO:0000269|PubMed:20452972, ECO:0000269|PubMed:22622177, ECO:0000269|PubMed:24128730, ECO:0000269|PubMed:27368102, ECO:0000269|PubMed:28380357, ECO:0000269|PubMed:28404643,","label: attribute=""display name"" labelsize=12 labelAlignment=left outline=true outlineColor=white outlineTransparency=95 outlineWidth=10 background=false color=black dropShadow=false",,"https://version-12-0.string-db.org/images/Proteinpictures/pdb/6t/6th3_A.png","stringdb","protein","MASLTVKAYLLGKEDAAREIRRFSFCCSPEPEAEAEAAAGPGPCERLLSRVAALFPALRPGGFQAHYRDEDGDLVAFSSDEELTMAMSYVKDDIFRIYIKEKKECRRDHRPPCAQEAPRNMVHPNVICDGCNGPVVGTRYKCSVCPDYDLCSVCEGKGLHRGHTKLAFPSPFGHLSEGFSHSRWLRKVKHGHFGWPGWEMGPPGNWSPRPPRAGEARPGPTAESASGPSEDPSVNFLKNVGESVAAALSPLGIEVDIDVEHGGKRSRLTPVSPESSSTEEKSSSQPSSCCSDPSKPGGNVEGATQSLAEQMRKIALESEGRPEEQMESDNCSGGDDDWTHLSSKEVDPSTGELQSLQMPESEGPSSLDPSQEGPTGLKEAALYPHLPPEADPRLIESLSQMLSMGFSDEGGWLTRLLQTKNYDIGAALDTIQYSKHPPPL","Homo sapiens","string:","6khz,5yp7,4mjs,6mj7,6th3,3wdz,2k6q,2knv","Tbio","Other","3.135077","4.011981","3.177965","3.150128","4.568268","2.693614","3.567969","4.647852","4.634549","4.948487","4.939191","3.975813","4.991431","4.948318","2.769025","4.987953","3.215068","3.605874","4.075815","2.506466"
"stringdb:9606.ENSP00000262746","2.236002","4.276984","2.173942","1.401651","4.502657","1.287975","1.826651","3.656436","5.0","2.25519","2.638249","PRDX1","9606.ENSP00000262746","PRDX1","false","9606.ENSP00000262746","Q06830","9606.ENSP00000262746","Peroxiredoxin-1; Thiol-specific peroxidase that catalyzes the reduction of hydrogen peroxide and organic hydroperoxides to water and alcohols, respectively. Plays a role in cell protection against oxidative stress by detoxifying peroxides and as sensor of hydrogen peroxide-mediated signaling events. Might participate in the signaling cascades of growth factors and tumor necrosis factor-alpha by regulating the intracellular concentrations of H(2)O(2) . Reduces an intramolecular disulfide bond in GDPD5 that gates the ability to GDPD5 to drive postmitotic motor neuron differentiation (By similarity). ","label: attribute=""display name"" labelsize=12 labelAlignment=left outline=true outlineColor=white outlineTransparency=95 outlineWidth=10 background=false color=black dropShadow=false",,"https://version-12-0.string-db.org/images/Proteinpictures/pdb/7l/7lj1_A.png","stringdb","protein","MSSGNAKIGHPAPNFKATAVMPDGQFKDISLSDYKGKYVVFFFYPLDFTFVCPTEIIAFSDRAEEFKKLNCQVIGASVDSHFCHLAWVNTPKKQGGLGPMNIPLVSDPKRTIAQDYGVLKADEGISFRGLFIIDDKGILRQITVNDLPVGRSVDETLRLVQAFQFTDKHGEVCPAGWKPGSDTIKPDVQKSKEYFSKQK","Homo sapiens","string:","7lj1","Tchem","Other","2.933337","4.707769","3.596498","2.620105","4.613357","2.74534","4.064515","4.179882","4.183488","4.940634","4.787555","3.895759","4.976151","4.591542","2.500532","4.768725","3.292764","3.403626","3.312136","4.504257"
"stringdb:9606.ENSP00000377845","1.67159","4.799967","2.132887","1.081239","1.977556","1.430748","1.564559","2.462858","2.782757","1.32854","1.745938","ASNS","9606.ENSP00000377845","ASNS","false","9606.ENSP00000377845","Q549T9","9606.ENSP00000377845","Asparagine synthetase","label: attribute=""display name"" labelsize=12 labelAlignment=left outline=true outlineColor=white outlineTransparency=95 outlineWidth=10 background=false color=black dropShadow=false",,"https://version-12-0.string-db.org/images/Proteinpictures/pdb/6g/6gq3_A.png","stringdb","protein","MCGIWALFGSDDCLSVQCLSAMKIAHRGPDAFRFENVNGYTNCCFGFHRLAVVDPLFGMQPIRVKKYPYLWLCYNGEIYNHKKMQQHFEFEYQTKVDGEIILHLYDKGGIEQTICMLDGVFAFVLLDTANKKVFLGRDTYGVRPLFKAMTEDGFLAVCSEAKGLVTLKHSATPFLKVEPFLPGHYEVLDLKPNGKVASVEMVKYHHCRDVPLHALYDNVEKLFPGFEIETVKNNLRILFNNAVKKRLMTDRRIGCLLSGGLDSSLVAATLLKQLKEAQVQYPLQTFAIGMEDSPDLLAARKVADHIGSEHYEVLFNSEEGIQALDEVIFSLETYDITTVRASVGMYLISKYIRKNTDSVVIFSGEGSDELTQGYIYFHKAPSPEKAEEESERLLRELYLFDVLRADRTTAAHGLELRVPFLDHRFSSYYLSLPPEMRIPKNGIEKHLLRETFEDSNLIPKEILWRPKEAFSDGITSVKNSWFKILQEYVEHQVDDAMMANAAQKFPFNTPKTKEGYYYRQVFERHYPGRADWLSHYWMPKWINATDPSARTLTHYKSAVKA","Homo sapiens","string:","6gq3","Tchem","Enzyme","1.498982","4.63892","1.380957","2.234931","2.283848","0.869232","2.297029","4.377074","2.199478","2.747725","3.365851","4.579661","4.72197","2.668132","1.820466","2.259515","2.124536","2.148558","2.106942","1.011429"
"stringdb:9606.ENSP00000225577","2.920879","4.8835","2.558048","2.285991","2.689734","2.872438","2.866808","5.0","5.0","2.053925","2.872589","RPS6KB1","9606.ENSP00000225577","RPS6KB1","false","9606.ENSP00000225577","P23443","9606.ENSP00000225577","Ribosomal protein S6 kinase beta-1; Serine/threonine-protein kinase that acts downstream of mTOR signaling in response to growth factors and nutrients to promote cell proliferation, cell growth and cell cycle progression. Regulates protein synthesis through phosphorylation of EIF4B, RPS6 and EEF2K, and contributes to cell survival by repressing the pro-apoptotic function of BAD. Under conditions of nutrient depletion, the inactive form associates with the EIF3 translation initiation complex. Upon mitogenic stimulation, phosphorylation by the mammalian target of rapamycin complex 1 (mTORC1) leads to dissociation from the EIF3 complex and activation. The active form then phosphorylates and activates several substrates in the pre-initiation complex, including the EIF2B complex and the cap-binding complex component EIF4B. Also controls translation initiation by phosphorylating a negative regulator of EIF4A, PDCD4, targeting it for ubiquitination and subsequent proteolysis. Promotes initiation of the pioneer round of protein synthesis by phosphorylating POLDIP3/SKAR. In response to IGF1, activates translation elongation by phosphorylating EEF2 kinase (EEF2K), which leads to its inhibition and thus activation of EEF2. Also plays a role in feedback regulation of mTORC2 by mTORC1 by phosphorylating RICTOR, resulting in the inhibition of mTORC2 and AKT1 signaling. Mediates cell survival by phosphorylating the pro-apoptotic protein BAD and suppressing its pro-apoptotic function. Phosphorylates mitochondrial URI1 leading to dissociation of a URI1-PPP1CC complex. The free mitochondrial PPP1CC can then dephosphorylate RPS6KB1 at Thr-412, which is proposed to be a negative feedback mechanism for the RPS6KB1 anti-apoptotic function. Mediates TNF-alpha-induced insulin resistance by phosphorylating IRS1 at multiple serine residues, resulting in accelerated degradation of IRS1. In cells lacking functional TSC1-2 complex, constitutively phosphorylates and inhibits GSK3B. May be involved in cytoskeletal rearrangement through binding to neurabin. Phosphorylates and activates the pyrimidine biosynthesis enzyme CAD, downstream of MTOR (PubMed:11500364, PubMed:12801526, PubMed:14673156, PubMed:15071500, PubMed:15341740, PubMed:16286006, PubMed:17052453, PubMed:17053147, PubMed:17936702, PubMed:18952604, PubMed:19085255, PubMed:19720745, PubMed:19935711, PubMed:19995915, PubMed:23429703). Following activation by mTORC1, phosphorylates EPRS and thereby plays a key role in fatty acid uptake by adipocytes and also most probably in interferon-gamma-induced translation inhibition .  ECO:0000269|PubMed:14673156, ECO:0000269|PubMed:15071500, ECO:0000269|PubMed:15341740, ECO:0000269|PubMed:16286006, ECO:0000269|PubMed:17052453, ECO:0000269|PubMed:17053147, ECO:0000269|PubMed:17936702, ECO:0000269|PubMed:18952604, ECO:0000269|PubMed:19085255, ECO:0000269|PubMed:19720745, ECO:0000269|PubMed:19935711, ECO:0000269|PubMed:19995915,","label: attribute=""display name"" labelsize=12 labelAlignment=left outline=true outlineColor=white outlineTransparency=95 outlineWidth=10 background=false color=black dropShadow=false",,"https://version-12-0.string-db.org/images/Proteinpictures/pdb/3a/3a60_A.png","stringdb","protein","MRRRRRRDGFYPAPDFRDREAEDMAGVFDIDLDQPEDAGSEDELEEGGQLNESMDHGGVGPYELGMEHCEKFEISETSVNRGPEKIRPECFELLRVLGKGGYGKVFQVRKVTGANTGKIFAMKVLKKAMIVRNAKDTAHTKAERNILEEVKHPFIVDLIYAFQTGGKLYLILEYLSGGELFMQLEREGIFMEDTACFYLAEISMALGHLHQKGIIYRDLKPENIMLNHQGHVKLTDFGLCKESIHDGTVTHTFCGTIEYMAPEILMRSGHNRAVDWWSLGALMYDMLTGAPPFTGENRKKTIDKILKCKLNLPPYLTQEARDLLKKLLKRNAASRLGAGPGDAGEVQAHPFFRHINWEELLARKVEPPFKPLLQSEEDVSQFDSKFTRQTPVDSPDDSTLSESANQVFLGFTYVAPSVLESVKEKFSFEPKIRSPRRFIGSPRTPVSPVKFSPGDFWGRGASASTANPQTPVEYPMETSGIEQMDVTMSGEASAPLPIRQPNSGPYKKQAFPMISKRPEHLRMNL","Homo sapiens","string:","3a60,4rlo","Tchem","Kinase","2.625719","3.249149","2.414954","2.864374","4.478267","1.878109","3.240314","3.203","3.174022","3.358217","3.157867","3.580044","4.168404","3.021446","1.974192","2.874688","2.855216","2.701231","2.733447","1.881054"
"stringdb:9606.ENSP00000336799","5.0","3.535117","1.577165","1.276561","1.676235","1.276909","1.293142","1.880846","2.141037","0.944753","1.791536","TUBA1B","9606.ENSP00000336799","TUBA1B","false","9606.ENSP00000336799","P68363","9606.ENSP00000336799","Detyrosinated tubulin alpha-1B chain; Tubulin is the major constituent of microtubules. It binds two moles of GTP, one at an exchangeable site on the beta chain and one at a non-exchangeable site on the alpha chain.","label: attribute=""display name"" labelsize=12 labelAlignment=left outline=true outlineColor=white outlineTransparency=95 outlineWidth=10 background=false color=black dropShadow=false",,"https://version-12-0.string-db.org/images/Proteinpictures/pdb/7m/7m20_A.png","stringdb","protein","MRECISIHVGQAGVQIGNACWELYCLEHGIQPDGQMPSDKTIGGGDDSFNTFFSETGAGKHVPRAVFVDLEPTVIDEVRTGTYRQLFHPEQLITGKEDAANNYARGHYTIGKEIIDLVLDRIRKLADQCTGLQGFLVFHSFGGGTGSGFTSLLMERLSVDYGKKSKLEFSIYPAPQVSTAVVEPYNSILTTHTTLEHSDCAFMVDNEAIYDICRRNLDIERPTYTNLNRLISQIVSSITASLRFDGALNVDLTEFQTNLVPYPRIHFPLATYAPVISAEKAYHEQLSVAEITNACFEPANQMVKCDPRHGKYMACCLLYRGDVVPKDVNAAIATIKTKRSIQFVDWCPTGFKVGINYQPPTVVPGGDLAKVQRAVCMLSNTTAIAEAWARLDHKFDLMYAKRAFVHWYVGEGMEEGEFSEAREDMAALEKDYEEVGVDSVEGEGEEEGEEY","Homo sapiens","string:","7m20","Tchem","Other","2.694436","4.796766","4.352061","3.202336","4.951114","2.254468","4.577881","4.949747","4.8818","4.959034","4.986309","4.890741","5.0","4.81921","2.546128","4.984589","3.714487","4.592059","2.706254","2.429106"
"stringdb:9606.ENSP00000351273","4.689281","5.0","2.830825","2.295986","2.919855","2.040098","2.712595","4.811239","4.843052","1.852318","5.0","CASP8","9606.ENSP00000351273","CASP8","false","9606.ENSP00000351273","Q9UQ81","9606.ENSP00000351273","Caspase-8 subunit p10; Most upstream protease of the activation cascade of caspases responsible for the TNFRSF6/FAS mediated and TNFRSF1A induced cell death. Binding to the adapter molecule FADD recruits it to either receptor. The resulting aggregate called death-inducing signaling complex (DISC) performs CASP8 proteolytic activation. The active dimeric enzyme is then liberated from the DISC and free to activate downstream apoptotic proteases. Proteolytic fragments of the N-terminal propeptide (termed CAP3, CAP5 and CAP6) are likely retained in the DISC. Cleaves and activates CASP3, CASP4, CASP6, CASP7, CASP9 and CASP10. May participate in the GZMB apoptotic pathways. Cleaves ADPRT. Hydrolyzes the small-molecule substrate, Ac-Asp-Glu-Val-Asp-|-AMC. Likely target for the cowpox virus CRMA death inhibitory protein. Isoform 5, isoform 6, isoform 7 and isoform 8 lack the catalytic site and may interfere with the pro-apoptotic activity of the complex . Cleaves RIPK1 at 'Asp-325' which is crucial for limiting apoptosis and necroptosis during embryonic development (By similarity).","label: attribute=""display name"" labelsize=12 labelAlignment=left outline=true outlineColor=white outlineTransparency=95 outlineWidth=10 background=false color=black dropShadow=false",,"https://version-12-0.string-db.org/images/Proteinpictures/pdb/4p/4ps1_A.png","stringdb","protein","MEGGRRARVVIESKRNFFLGAFPTPFPAEHVELGRLGDSETAMVPGKGGADYILLPFKKMDFSRNLYDIGEQLDSEDLASLKFLSLDYIPQRKQEPIKDALMLFQRLQEKRMLEESNLSFLKELLFRINRLDLLITYLNTRKEEMERELQTPGRAQISAYRVMLYQISEEVSRSELRSFKFLLQEEISKCKLDDDMNLLDIFIEMEKRVILGEGKLDILKRVCAQINKSLLKIINDYEEFSKERSSSLEGSPDEFSNGEELCGVMTISDSPREQDSESQTLDKVYQMKSKPRGYCLIINNHNFAKAREKVPKLHSIRDRNGTHLDAGALTTTFEELHFEIKPHDDCTVEQIYEILKIYQLMDHSNMDCFICCILSHGDKGIIYGTDGQEAPIYELTSQFTGLKCPSLAGKPKVFFIQACQGDNYQKGIPVETDSEEQPYLEMDLSSPQTRYIPDEADFLLGMATVNNCVSYRNPAEGTWYIQSLCQSLRERCPRGDDILTILTEVNYEVSNKDDKKNMGKQMPQPTFTLRKKLVFPSD","Homo sapiens","string:","2y1l,5l08,4ps1,7lvj,1qdu,1qdu","Tchem","Enzyme","2.61168","4.743626","2.399842","3.413987","2.579076","2.099129","3.143689","3.617347","3.241434","3.333762","3.428705","2.94991","3.189995","2.816285","2.224306","3.062941","3.379741","2.988338","2.396399","2.122275"
